carrera,carrera_grupo,Carrera_normalizada
Abogado,Juridicas,Abogacia
Abogado - Ciclo de Complementacion Curricular,Juridicas,Abogacia
Abogado - MD,Juridicas,Abogacia
Abogado (Plan 2017),Juridicas,Abogacia
Abogado Especialista en Administracion de Justicia,Juridicas,Abogacia
Abogado especialista en Asesoramiento de Empresas,Juridicas,Abogacia
Abogado Especialista en Asesoria Juridica de Empresas,Juridicas,Abogacia
Abogado Especialista en Contratos y Derechos de Daños,Juridicas,Abogacia
Abogado especialista en Derecho Administrativo Economico,Juridicas,Abogacia
Abogado Especialista en Derecho Administrativo y Administracion Publica,Juridicas,Abogacia
Abogado especialista en Derecho Ambiental,Juridicas,Abogacia
Abogado especialista en Derecho de Alta Tecnologia,Juridicas,Abogacia
Abogado especialista en Derecho Penal,Juridicas,Abogacia
Abogado especialista en Derecho Procesal,Juridicas,Abogacia
Abogado Especialista en Derecho Procesal Constitucional,Juridicas,Abogacia
Abogado Especialista en Derecho Tributario,Juridicas,Abogacia
Abogado especialista en Magistratura,Juridicas,Abogacia
Abogado especializado para la Magistratura,Juridicas,Abogacia
Abogado/a,Juridicas,Abogacia
Accidentologo,Otros,Otros
Acompañante Terapeutico,Psicologia,Psicologia
Actor Dramatico,Artes,Teatro y Danza
Actor Profesional,Artes,Teatro y Danza
Actuario,Economicas,Actuariales
Actuario (Administracion),Economicas,Actuariales
Actuario (Economia),Economicas,Actuariales
Agente de Propaganda de Medicamentos,Otros,Otros
Agente de Propaganda Medica,Comunicacion,Publicidad y Marketing
Agente de Viajes y Turismo,"Hoteleria, Gastronomia y Turismo",Turismo
Agrimensor,Ingenieria,Agrimensura
Analista Administrativo,Economicas,Adm. Empresas
Analista Administrativo Agropecuario,Economicas,Adm. Agraria
Analista Administrativo Contable,Economicas,Contabilidad y Estadistica
Analista Administrativo Universitaria,Economicas,Adm. Empresas
Analista Administrativo Universitario,Economicas,Adm. Empresas
Analista Ambiental,Naturales,Ambiente
Analista Ambiental Universitaria,Naturales,Ambiente
Analista Ambiental Universitario,Naturales,Ambiente
Analista Biologico,Naturales,Biologia
Analista Contable,Economicas,Contabilidad y Estadistica
Analista Contable Universitario - MD,Economicas,Contabilidad y Estadistica
Analista Contable y Administrativo,Economicas,Contabilidad y Estadistica
Analista de Marketing,Comunicacion,Publicidad y Marketing
Analista de Negocios,Economicas,Adm. Empresas
Analista de Recursos Humanos,Sociales,Recursos Humanos
Analista de Seguridad,Otros,Otros
Analista de Sistemas,Informatica,Analista
Analista de Sistemas - MD,Informatica,Analista
Analista de Sistemas de Informacion,Informatica,Sistemas de Informacion
Analista de Sistemas de Informacion,Informatica,Sistemas de Informacion
Analista de Sistemas de Informacion Medica,Informatica,Sistemas de Informacion
Analista de Sistemas de Informatica,Informatica,Analista
Analista de Sistemas de Informatica,Informatica,Analista
Analista de Sistemas Informaticos,Informatica,Analista
Analista de Sistemas Informaticos,Informatica,Analista
Analista de Software,Informatica,Analista
Analista Economico,Economicas,Economia y Finanzas
Analista en Administracion,Otros,Otros
Analista en Administracion Agraria,Economicas,Adm. Agraria
Analista en Administracion Hotelera,"Hoteleria, Gastronomia y Turismo",Hoteleria
Analista en Administracion Turistica,"Hoteleria, Gastronomia y Turismo",Turismo
Analista en Calidad Industrial,Otros,Otros
Analista en Ciencias Ambientales,Naturales,Ambiente
Analista en Comercializacion,Comunicacion,Publicidad y Marketing
Analista en Comercio Internacional,Economicas,Comercio Exterior
Analista en Computacion,Informatica,Analista
Analista en Computacion,Informatica,Analista
Analista en Desarrollo de Recursos Humanos,Sociales,Recursos Humanos
Analista en Economia,Economicas,Economia y Finanzas
Analista en Energia,Otros,Otros
Analista en Finanzas,Economicas,Economia y Finanzas
Analista en Gestion Administrativa,Otros,Otros
Analista en Gestion Educativa - MD,Educacion,Gestion Educativa
Analista en Informacion Gerencial,Economicas,Adm. Empresas
Analista en Informatica,Informatica,Analista
Analista en Informatica,Informatica,Analista
Analista en Informatica Aplicada,Informatica,Analista
Analista en Informatica Aplicada (titulo Intermedio),Informatica,Analista
Analista en Informatica Aplicada (Titulo Intermedio),Informatica,Analista
Analista en Marketing,Comunicacion,Publicidad y Marketing
Analista en Marketing - MD,Comunicacion,Publicidad y Marketing
Analista en Medios de Comunicacion Social,Comunicacion,Periodismo
Analista en Opinion Publica,Comunicacion,Periodismo
Analista en Organizacion,Economicas,Adm. Empresas
Analista en Organizacion Industrial,Economicas,Adm. Industrial
Analista en Politica y Administracion Publica,Sociales,Ciencia Politica
Analista en Recursos Humanos,Sociales,Recursos Humanos
Analista en Relaciones del Trabajo,Sociales,Recursos Humanos
Analista en Relaciones Laborales,Sociales,Recursos Humanos
Analista en Relaciones Publicas,Otros,Otros
Analista en Sistemas,Informatica,Analista
Analista en Sistemas de Computacion,Informatica,Analista
Analista en Sistemas de Computacion,Informatica,Analista
Analista en Sistemas de Informacion,Informatica,Sistemas de Informacion
Analista en Sistemas de Informacion,Informatica,Sistemas de Informacion
Analista en Sistemas Informaticos,Informatica,Analista
Analista en Sistemas Informaticos,Informatica,Analista
Analista en Tecnologia de la Informacion,Informatica,Analista
Analista en Tecnologia y Calidad Industrial en Alimentos,Otros,Otros
Analista Industrial,Economicas,Adm. Industrial
Analista Politico Universitaria,Sociales,Ciencia Politica
Analista Politico Universitario,Otros,Otros
Analista Programador,Informatica,Analista
Analista Programador - MD,Informatica,Analista
Analista Programador Universitaria,Informatica,Analista
Analista Programador Universitario,Informatica,Analista
Analista Quimica,Exactas,Quimica
Analista Quimica - Titulo Intermedio,Exactas,Quimica
Analista Quimica Universitaria,Exactas,Quimica
Analista Quimica Universitario,Exactas,Quimica
Analista Universitaria Contable,Economicas,Contabilidad y Estadistica
Analista Universitaria Contable - MD,Economicas,Contabilidad y Estadistica
Analista Universitaria de Alimentos,Naturales,Alimentos
Analista Universitaria de Computacion,Informatica,Analista
Analista Universitaria de Computacion,Informatica,Analista
Analista Universitaria de Mercado y Estrategias de Comercializacion,Comunicacion,Publicidad y Marketing
Analista Universitaria de Sistemas,Informatica,Analista
Analista Universitaria de Sistemas de Informacion,Informatica,Sistemas de Informacion
Analista Universitaria de Sistemas Informaticos,Informatica,Analista
Analista Universitaria de Sistemas Informaticos,Informatica,Analista
Analista Universitaria de Tecnologias Viales y de Transporte,Otros,Otros
Analista Universitaria en Administracion,Economicas,Adm. Empresas
Analista Universitaria en Administracion de Empresas,Economicas,Adm. Empresas
Analista Universitaria en Administracion de Empresas (Contador Publico),Economicas,Adm. Empresas
Analista Universitaria en Administracion Publica,Sociales,Administracion Publica
Analista Universitaria en Administracion y Contabilidad del Sector Publico con Orientacion en Administracion Maritima,Sociales,Administracion Publica
Analista Universitaria en Bancos y Finanzas,Economicas,Economia y Finanzas
Analista Universitaria en Comercializacion,Comunicacion,Publicidad y Marketing
Analista Universitaria en Comercializacion (Lic.Com. 4 años),Comunicacion,Publicidad y Marketing
Analista Universitaria en Comercializacion y Direccion de Empresas,Comunicacion,Publicidad y Marketing
Analista Universitaria en Comercio Internacional,Economicas,Comercio Exterior
Analista Universitaria en Comercio Internacional (Lic.C.I. 4 años),Economicas,Comercio Exterior
Analista Universitaria en Comunicacion Audiovisual,Comunicacion,Periodismo
Analista Universitaria en Comunicacion Publicitaria,Comunicacion,Periodismo
Analista Universitaria en Diseño Industrial,Diseño,Industrial
Analista Universitaria en Gestion Administrativo Contable,Economicas,Adm. Empresas
Analista Universitaria en Gestion de Capital Humano - MD,Sociales,Recursos Humanos
Analista Universitaria en Gestion de Empresas (Cont.Pub.),Economicas,Contabilidad y Estadistica
Analista Universitaria en Gestion de Empresas (Lic. Ing.Com. 4 años),Economicas,Adm. Empresas
Analista Universitaria en Gestion de Empresas (Lic.Administ.),Economicas,Adm. Empresas
Analista Universitaria en Marketing,Comunicacion,Publicidad y Marketing
Analista Universitaria en Mercado y Estrategias de Comercializacion - Modalidad a Distancia,Comunicacion,Publicidad y Marketing
Analista Universitaria en Monitoreo del Ambiente,Naturales,Ambiente
Analista Universitaria en Negocios,Economicas,Adm. Empresas
Analista Universitaria en Organizacion de la Produccion,Economicas,Adm. Industrial
Analista Universitaria en Recursos Humanos,Sociales,Recursos Humanos
Analista Universitaria en Redes,Informatica,Analista
Analista Universitaria en Relaciones Publicas,Comunicacion,Relaciones Publicas
Analista Universitaria en Relaciones Publicas e Institucionales,Comunicacion,Relaciones Publicas
Analista Universitaria en Relaciones Publicas e Institucionales - MD,Comunicacion,Relaciones Publicas
Analista Universitaria en Seguridad del Trabajo en Buques y ambito Portuario,Ingenieria,Naval
Analista Universitaria en Seguridad Maritima,Sociales,Relaciones Internacionales
Analista Universitaria en Sistemas,Informatica,Analista
Analista Universitaria en Sistemas de Computacion,Informatica,Analista
Analista Universitaria en Sistemas de Computacion,Informatica,Analista
Analista Universitaria en Sistemas de Computacion - MD,Informatica,Analista
Analista Universitaria en Sistemas de Informacion,Informatica,Sistemas de Informacion
Analista Universitaria en Sistemas y Gestion,Informatica,Analista
Analista Universitario Contable,Economicas,Contabilidad y Estadistica
Analista Universitario Contable - MD,Economicas,Contabilidad y Estadistica
Analista Universitario de Alimentos,Otros,Otros
Analista Universitario de Computacion,Informatica,Analista
Analista Universitario de Sistemas,Informatica,Analista
Analista Universitario de Sistemas de Informacion,Informatica,Sistemas de Informacion
Analista Universitario de Sistemas Informaticos,Informatica,Analista
Analista Universitario de Tecnologias Viales y de Transporte,Otros,Otros
Analista Universitario en Administracion,Otros,Otros
Analista Universitario en Administracion de Empresas,Economicas,Adm. Empresas
Analista Universitario en Administracion de Sistemas y Empresas,Economicas,Adm. Empresas
Analista Universitario en Administracion Publica,Otros,Otros
Analista Universitario en Administracion Publica - MD,Otros,Otros
Analista Universitario en Administracion y Contabilidad del Sector Publico con Orientacion en Administracion Maritima,Otros,Otros
Analista Universitario en Bancos y Finanzas,Otros,Otros
Analista Universitario en Comercializacion,Otros,Otros
Analista Universitario en Comercializacion y Direccion de Empresas,Economicas,Adm. Empresas
Analista Universitario en Comercio Internacional,Otros,Otros
Analista Universitario en Comunicacion Audiovisual,Otros,Otros
Analista Universitario en Comunicacion Publicitaria,Otros,Otros
Analista Universitario en Diseño Industrial,Otros,Otros
Analista Universitario en Gestion Administrativo Contable,Otros,Otros
Analista Universitario en Gestion de Capital Humano,Otros,Otros
Analista Universitario en Gestion de Capital Humano - MD,Otros,Otros
Analista Universitario en Gestion de Empresas (Cont.Pub.),Economicas,Adm. Empresas
Analista Universitario en Gestion de Empresas (Lic. Ing.Com. 4 años),Economicas,Adm. Empresas
Analista Universitario en Gestion de Empresas (Lic.Administ.),Economicas,Adm. Empresas
Analista Universitario en Gestion de las Organizaciones Productivas,Otros,Otros
Analista Universitario en Monitoreo del Ambiente,Otros,Otros
Analista Universitario en Negocios,Economicas,Adm. Empresas
Analista Universitario en Recursos Humanos,Otros,Otros
Analista Universitario en Redes,Otros,Otros
Analista Universitario en Relaciones Industriales,Otros,Otros
Analista Universitario en Relaciones Laborales,Otros,Otros
Analista Universitario en Relaciones Laborales - MD,Otros,Otros
Analista Universitario en Relaciones Publicas,Otros,Otros
Analista Universitario en Relaciones Publicas e Institucionales,Otros,Otros
Analista Universitario en Seguridad del Trabajo en Buques y ambito Portuario,Otros,Otros
Analista Universitario en Seguridad Maritima,Otros,Otros
Analista Universitario en Sistemas,Informatica,Analista
Analista Universitario en Sistemas de Informacion,Informatica,Sistemas de Informacion
Analista Universitario en Tecnologia de la Informacion,Otros,Otros
Archivero,Otros,Bibliotecologia y Documentacion
Archivista,Otros,Bibliotecologia y Documentacion
Archivista y Licenciatura en Ciencias de la Informacion,Otros,Bibliotecologia y Documentacion
Archivista y Licenciatura en Ciencias de la Informacion - Ciclo de Licenciatura,Otros,Bibliotecologia y Documentacion
Arqueologo,Sociales,Arqueologia
Arquitecto,Arquitectura y Urbanismo,Arquitectura
"Arquitecto Especialista en Preservacion, Conservacion y Reciclaje del Patrimonio Monumental Urbano",Arquitectura y Urbanismo,Arquitectura
Arquitecto Naval,Arquitectura y Urbanismo,Arquitectura Naval
Asistente de Ingenieria en Computacion,Informatica,Ing.Computacion
Asistente de Investigacion en Fisica,Exactas,Fisica
Asistente Dental,Salud,Odontologia
Asistente Ejecutivo/a,Economicas,Adm. Empresas
Asistente en Orientacion Educativa,Educacion,Cs. Educacion
Asistente en Psicologia,Psicologia,Psicologia
Asistente en Publicidad,Comunicacion,Periodismo
Asistente Juridico Universitaria,Juridicas,Abogacia
Asistente Odontologico,Salud,Odontologia
Asistente Psicopedagogico,Psicologia,Psicopedagogia
Asistente Social,Psicologia,Trabajo Social
Asistente Universitaria en Direccion Teatral,Artes,Teatro y Danza
Asistente Universitaria en Nutricion,Salud,Nutricion
Asistente Universitaria en Psicologia,Psicologia,Psicologia
Asistente Universitaria en Relaciones Laborales,Sociales,Recursos Humanos
Asistente Universitaria en Sistemas Electricas,Ingenieria,Electromecanica
Asistente Universitario en Direccion Teatral,Otros,Otros
Asistente Universitario en Nutricion,Otros,Otros
Asistente Universitario en Psicologia,Psicologia,Psicologia
Asistente Universitario en Relaciones Laborales,Otros,Otros
Asistente Universitario en Sistemas Electricas,Informatica,Analista
Auditor Nacional de Industrias Alimentarias,Naturales,Alimentos
Auxiliar de Farmacia,Otros,Otros
Auxiliar de Ingenieria Electricista,Ingenieria,Electrica
Auxiliar de Taller en Bellas Artes,Artes,Otros
Auxiliar de Taller en Bellas Artes -titulo intermedio de la carrera de Licenciatura en Bellas Artes-,Artes,Otros
Auxiliar de Taller en Bellas Artes -titulo intermedio de la carrera de Profesorado en Bellas Artes-,Educacion,Profesorado
Auxiliar en Fisica,Exactas,Fisica
Auxiliar en Fisica Aplicada,Exactas,Fisica
Auxiliar Tecnicatura en Antropologia,Sociales,Antropologia
Auxiliar Universitario en Diseño,Otros,Otros
Ayudante de Gabinete,Educacion,Otros
Ayudante de Gabinete Psicologico,Psicologia,Psicologia
Bachiller Elemental en Ingles,Comunicacion,Idiomas Extranjeros
Bachiller en Ciencias Economicas,Economicas,Economia y Finanzas
Bachiller en Ciencias Economicas - MD,Economicas,Economia y Finanzas
Bachiller en Ciencias Sociales,Sociales,Otros
Bachiller en Economia,Economicas,Economia y Finanzas
Bachiller en Humanidades,Sociales,Filosofia
Bachiller en Teologia,Sociales,Teologia
Bachiller Superior en Geografia,Otros,Otros
Bachiller Superior en Historia,Sociales,Historia y Geografia
Bachiller Superior en Historia de las Artes,Sociales,Historia y Geografia
Bachiller Superior en Ingles,Comunicacion,Idiomas Extranjeros
Bachiller Superior en Letras,Otros,Otros
Bachiller Superior en Teologia,Sociales,Teologia
Bachiller Universitaria,Otros,Otros
Bachiller Universitaria - titulo intermedio de la carrera de Bioquimica (Plan 1997)-,Salud,Bioquimica y Farmacia
Bachiller Universitaria -titulo intermedio de la carrera de Abogacia-,Juridicas,Abogacia
Bachiller Universitaria -titulo intermedio de la carrera de Arquitectura-,Arquitectura y Urbanismo,Arquitectura
Bachiller Universitaria -titulo intermedio de la carrera de Bioquimica-,Salud,Bioquimica y Farmacia
Bachiller Universitaria -titulo intermedio de la carrera de Farmacia (Plan 1997)-,Salud,Bioquimica y Farmacia
Bachiller Universitaria -titulo intermedio de la carrera de Farmacia-,Salud,Bioquimica y Farmacia
Bachiller Universitaria -titulo intermedio de la carrera de Licenciatura en Antropologia-,Sociales,Antropologia
Bachiller Universitaria -titulo intermedio de la carrera de Licenciatura en Ciencia y Tecnologia de los Alimentos-,Naturales,Alimentos
Bachiller Universitaria -titulo intermedio de la carrera de Licenciatura en Ciencias de la Educacion-,Educacion,Cs. Educacion
Bachiller Universitaria -titulo intermedio de la carrera de Licenciatura en Historia-,Sociales,Historia y Geografia
Bachiller Universitaria -titulo intermedio de la carrera de Licenciatura en Portugues-,Comunicacion,Idiomas Extranjeros
Bachiller Universitaria -titulo intermedio de la carrera de Licenciatura en Quimica (Plan 1997)-,Exactas,Quimica
Bachiller Universitaria -titulo intermedio de la carrera de Licenciatura en Quimica-,Exactas,Quimica
Bachiller Universitaria -titulo intermedio de la carrera de Licenciatura en Recursos Naturales-,Naturales,Ambiente
Bachiller Universitaria -titulo intermedio de la carrera de Licenciatura enBiotecnologia (Plan 1997)-,Naturales,Biologia
Bachiller Universitaria -titulo intermedio de la carrera de Licenciatura enBiotecnologia-,Naturales,Biologia
Bachiller Universitaria -titulo intermedio de la carrera de Medicina Veterinaria-,Naturales,Veterinaria
Bachiller Universitaria -titulo intermedio de la carrera de Odontologia-,Salud,Odontologia
Bachiller Universitaria -titulo intermedio de la carrera de Profesor en Antropologia-,Sociales,Antropologia
Bachiller Universitaria -titulo intermedio de la carrera de Profesor en Historia-,Educacion,Profesorado
Bachiller Universitaria -titulo intermedio de la carrera de Profesor en Quimica-,Educacion,Otros
Bachiller Universitaria -titulo intermedio de la carrera de Profesorado en Portugues-,Educacion,Otros
Bachiller Universitaria -titulo intermedio de la carrera de Traductor Publico en Portugues-,Comunicacion,Idiomas Extranjeros
Bachiller Universitaria con mencion en Administracion,Economicas,Adm. Empresas
Bachiller Universitaria con mencion en Arquitectura,Arquitectura y Urbanismo,Arquitectura
Bachiller Universitaria con mencion en Ciencia Politica,Sociales,Ciencia Politica
Bachiller Universitaria con mencion en Ciencias de la Educacion,Educacion,Cs. Educacion
Bachiller Universitaria con mencion en Ciencias de la Educacion -titulo intermedio de la carrera de Licenciatura en Ciencias de la E,Educacion,Cs. Educacion
Bachiller Universitaria con mencion en Comunicacion Social,Comunicacion,Periodismo
Bachiller Universitaria con mencion en Contabilidad,Economicas,Contabilidad y Estadistica
Bachiller Universitaria con mencion en Economia,Economicas,Economia y Finanzas
Bachiller Universitaria con mencion en Estadistica,Economicas,Contabilidad y Estadistica
Bachiller Universitaria con mencion en Letras,Comunicacion,Letras
Bachiller Universitaria con mencion en Letras -titulo intermedio de la carrera de Licenciatura en Letras-,Comunicacion,Letras
Bachiller Universitaria con mencion en Letras -titulo intermedio de la carrera de Profesor en Letras-,Educacion,Profesorado
Bachiller Universitaria con mencion en Matematica,Exactas,Matematica
Bachiller Universitaria con mencion en Matematica -titulo intermedio de la carrera de Licenciatura en Matematica-,Exactas,Matematica
Bachiller Universitaria con mencion en Matematica y Profesor en Matematica,Exactas,Matematica
Bachiller Universitaria con mencion en Quimica,Exactas,Quimica
Bachiller Universitaria con mencion en Quimica -titulo intermedio de la carrera de Bioquimica (Plan 1997)-,Salud,Bioquimica y Farmacia
Bachiller Universitaria con mencion en Quimica -titulo intermedio de la carrera de Bioquimica-,Salud,Bioquimica y Farmacia
Bachiller Universitaria con mencion en Quimica -titulo intermedio de la carrera de Farmacia (Plan 1997)-,Salud,Bioquimica y Farmacia
Bachiller Universitaria con mencion en Quimica -titulo intermedio de la carrera de Farmacia-,Salud,Bioquimica y Farmacia
Bachiller Universitaria con mencion en Quimica -titulo intermedio de la carrera de Licenciatura en Ciencia y Tecnologia de los Ali,Exactas,Quimica
Bachiller Universitaria con mencion en Quimica -titulo intermedio de la carrera de Licenciatura en Quimica (Plan 1997)-,Exactas,Quimica
Bachiller Universitaria con mencion en Quimica -titulo intermedio de la carrera de Licenciatura en Quimica-,Exactas,Quimica
Bachiller Universitaria con mencion en Quimica -titulo intermedio de la carrera de Licenciatura enBiotecnologia-,Salud,Bioquimica y Farmacia
Bachiller Universitaria con mencion en Relaciones Internacionales,Sociales,Relaciones Internacionales
Bachiller Universitaria con mencion en Trabajo Social,Psicologia,Trabajo Social
Bachiller Universitaria de la carrera de Medicina -titulo intermedio de la carrera de Medicina-,Salud,Medicina
Bachiller Universitaria en Administracion Naval,Economicas,Adm. Empresas
Bachiller Universitaria en Agronomia,Naturales,Agronomia
Bachiller Universitaria en Arte,Artes,Otros
Bachiller Universitaria en Ciencias con Orientacion en Analisis Ambiental,Naturales,Otros
Bachiller Universitaria en Ciencias con Orientacion en Fisica Medica,Exactas,Otros
Bachiller Universitaria en Ciencias con Orientacion enBiotecnologia,Naturales,Biologia
Bachiller Universitaria en Ciencias de la Atmosfera,Exactas,Atmosfera
Bachiller Universitaria en Ciencias de la Atmosfera Orientacion Climatologia,Exactas,Atmosfera
Bachiller Universitaria en Ciencias de la Atmosfera Orientacion Meteorologia Sinoptica,Exactas,Atmosfera
Bachiller Universitaria en Ciencias de la Ingenieria,Ingenieria,Otros
Bachiller Universitaria en Ciencias de la Ingenieria -titulo intermedio de la carrera de Agrimensura (Plan1985)-,Ingenieria,Agrimensura
Bachiller Universitaria en Ciencias de la Ingenieria -titulo intermedio de la carrera de Ingenieria Agrimensura-,Ingenieria,Agrimensura
Bachiller Universitaria en Ciencias de la Ingenieria -titulo intermedio de la carrera de Ingenieria Civil-,Ingenieria,Civil
Bachiller Universitaria en Ciencias de la Ingenieria -titulo intermedio de la carrera de Ingenieria Electrica-,Ingenieria,Electrica
Bachiller Universitaria en Ciencias de la Ingenieria -titulo intermedio de la carrera de Ingenieria Electronica-,Ingenieria,Electronica
Bachiller Universitaria en Ciencias de la Ingenieria -titulo intermedio de la carrera de Ingenieria Industrial-,Ingenieria,Industrial
Bachiller Universitaria en Ciencias de la Ingenieria -titulo intermedio de la carrera de Ingenieria Mecanica-,Ingenieria,Mecanica
Bachiller Universitaria en Ciencias Exactas,Exactas,Otros
Bachiller Universitaria en Ciencias Exactas -titulo intermedio de la carrera de Licenciatura en Ciencias de la Computacion-,Informatica,Lic.Cs.Computacion
Bachiller Universitaria en Ciencias Exactas -titulo intermedio de la carrera de Licenciatura en Fisica-,Exactas,Fisica
Bachiller Universitaria en Ciencias Psicologicas,Psicologia,Psicologia
Bachiller Universitaria en Derecho,Juridicas,Abogacia
Bachiller Universitaria en Fisica,Exactas,Fisica
Bachiller Universitaria en Periodismo,Comunicacion,Periodismo
Bachiller Universitaria en Psicologia,Psicologia,Psicologia
Bachiller Universitaria en Relaciones Internacionales,Sociales,Relaciones Internacionales
Bachiller Universitaria en Relaciones Publicas,Comunicacion,Relaciones Publicas
Bachiller Universitaria en Sistemas de Informacion,Informatica,Sistemas de Informacion
Bachiller Universitario -titulo intermedio de la carrera de Abogacia-,Otros,Otros
Bachiller Universitario -titulo intermedio de la carrera de Arquitectura-,Arquitectura y Urbanismo,Arquitectura
Bachiller Universitario -titulo intermedio de la carrera de Bioquimica-,Otros,Otros
Bachiller Universitario -titulo intermedio de la carrera de Contador Publico-,Otros,Otros
Bachiller Universitario -titulo intermedio de la carrera de Farmacia-,Otros,Otros
Bachiller Universitario -titulo intermedio de la carrera de Licenciatura en Administracion-,Otros,Otros
Bachiller Universitario -titulo intermedio de la carrera de Licenciatura en Antropologia-,Otros,Otros
Bachiller Universitario -titulo intermedio de la carrera de Licenciatura en Biotecnologia-,Otros,Otros
Bachiller Universitario -titulo intermedio de la carrera de Licenciatura en Ciencia Politica-,Otros,Otros
Bachiller Universitario -titulo intermedio de la carrera de Licenciatura en Ciencia y Tecnologia de los Alimentos-,Otros,Otros
Bachiller Universitario -titulo intermedio de la carrera de Licenciatura en Ciencias de la Educacion-,Educacion,Cs. Educacion
Bachiller Universitario -titulo intermedio de la carrera de Licenciatura en Comunicacion Social-,Otros,Otros
Bachiller Universitario -titulo intermedio de la carrera de Licenciatura en Economia-,Economicas,Economia y Finanzas
Bachiller Universitario -titulo intermedio de la carrera de Licenciatura en Estadistica-,Otros,Otros
Bachiller Universitario -titulo intermedio de la carrera de Licenciatura en Historia-,Sociales,Historia y Geografia
