carrera,carrera_grupo,Carrera_normalizada
Especialista en Ingenieria Sanitaria y Ambiental,Naturales,Ambiente
Especialista en Ingenieria Vial,Ingenieria,Otros
Especialista en Ingenieria Web,Informatica,Otros
Especialista en Ingenieria y Gestion de Mantenimiento,Ingenieria,Otros
Especialista en Ingresos Publicos,Economicas,Economia y Finanzas
Especialista en Inmunohematologia,Naturales,Biologia
Especialista en Inmunologia,Naturales,Biologia
Especialista en Inmunologia Clinica,Salud,Medicina
Especialista en Inocuidad y Calidad Agroalimentaria,Naturales,Alimentos
Especialista en Integracion de Tecnologias Informaticas,Informatica,Otros
Especialista en Interconexion de Redes y Servicios,Informatica,Otros
Especialista en Intereses Maritimos,Sociales,Ciencia Politica
Especialista en Interpretacion,Comunicacion,Letras
Especialista en Interpretacion Bilateral Ingles-Español / Español-Ingles,Comunicacion,Idiomas Extranjeros
Especialista en Intervencion Comunitaria en el ambito de la Salud Mental con enfasis en Derechos Humanos,Psicologia,Psicologia
Especialista en Intervencion Social en Niñez y Adolescencia,Sociales,Servicio Social
Especialista en Intervencion y Gestion Gerontologica,Salud,Medicina
Especialista en Intervenciones Psicologicas para la Salud Mental en Niñez y Adolescencia desde la Perspectiva Psicoanalitica Pluridisciplinar,Psicologia,Psicologia
"Especialista en Intervenciones Sociales con niños/as, adolescentes y jovenes",Sociales,Servicio Social
Especialista en Intervenciones Transdisciplinarias en Violencia Familiar y de Genero,Otros,Otros
Especialista en Investigacion Cientifica del Delito,Juridicas,Abogacia
Especialista en Investigacion de la Comunicacion,Comunicacion,Periodismo
Especialista en Investigacion Educativa,Educacion,Otros
Especialista en Investigacion en Ciencias Sociales y Humanas,Otros,Otros
Especialista en Investigacion Proyectual - Orientacion Vivienda,Arquitectura y Urbanismo,Arquitectura
Especialista en Kinefisiatria Critica Respiratoria,Salud,Kinesiologia
Especialista en Kinefisiatria Critica Respiratoria y Terapia Intensiva,Salud,Kinesiologia
Especialista en Kinesiologia Cardio - Respiratoria,Salud,Kinesiologia
Especialista en Kinesiologia del Deporte,Salud,Kinesiologia
Especialista en Kinesiologia Deportiva,Salud,Kinesiologia
Especialista en Kinesiologia Deportiva (con mencion de titulo de grado),Salud,Kinesiologia
Especialista en Kinesiologia y Fisiatria Intensivista,Salud,Kinesiologia
Especialista en Kinesiologia y Fisiatria Pediatrica y Neonatal,Salud,Kinesiologia
Especialista en Kinesiologia y Fisioterapia Cardiorespiratoria,Salud,Kinesiologia
Especialista en Kinesiologia y Fisioterapia del Deporte,Salud,Kinesiologia
Especialista en la Enseñanza de Español como Lengua Extranjera,Educacion,Otros
Especialista en la Enseñanza de la Educacion Fisica y el Deporte,Otros,Educacion Fisica y Deportes
Especialista en la Enseñanza de la Educacion Superior,Educacion,Otros
Especialista en la Enseñanza de la Lengua y la Literatura,Educacion,Otros
Especialista en la Enseñanza de las Ciencias Experimentales y la Tecnologia,Otros,Otros
Especialista en la Funcion Judicial,Juridicas,Abogacia
Especialista en la Gestion de las Pequeñas y Medianas Empresas(P.y M.E.S.),Economicas,Adm. Empresas
"Especialista en la Problematica del Uso Indebido de Drogas, Orientacion Investigacion",Psicologia,Otros
"Especialista en la Problematica del Uso Indebido de Drogas, orientacion Investigacion",Otros,Otros
"Especialista en la Problematica del Uso Indebido de Drogas, Orientacion Investigacion (con mencion al titulo de grado)",Psicologia,Otros
"Especialista en la Problematica del Uso Indebido de Drogas, orientacion Promocion y Prevencion",Otros,Otros
"Especialista en la Problematica del Uso Indebido de Drogas, orientacion Tratamiento y Rehabilitacion",Otros,Otros
Especialista en Legislacion y Gestion Portuaria,Juridicas,Abogacia
Especialista en Lenguaje y Comunicacion Digital,Comunicacion,Periodismo
Especialista en Lenguajes Artisticos,Artes,Otros
Especialista en Lenguajes Artisticos Combinados,Artes,Otros
Especialista en Liderazgo y Desarrollo Personal,Otros,Otros
"Especialista en Lingüistica Aplicada, Orientacion Enseñanza de Lenguas Extranjeras",Comunicacion,Letras
"Especialista en Lingüistica Aplicada, orientacion Enseñanza de Lenguas Extranjeras",Otros,Otros
Especialista en Literatura Hispanoamericana del siglo XX,Comunicacion,Letras
Especialista en Literatura Infantil y Juvenil,Comunicacion,Letras
Especialista en Logica y Tecnica de la Forma,Diseño,Industrial
Especialista en Logistica,Economicas,Logistica y Transportes
Especialista en Magistratura,Juridicas,Abogacia
Especialista en Magistratura Judicial,Juridicas,Abogacia
Especialista en Magistratura y Gestion Judicial,Juridicas,Abogacia
Especialista en Magistratura y Ministerio Publico,Otros,Otros
Especialista en Management Tecnologico,Otros,Otros
Especialista en Manejo Ambiental del Territorio,Naturales,Ambiente
Especialista en Manejo Ambiental en Patagonia Arida,Naturales,Ambiente
Especialista en Manejo de Agroquimicos,Naturales,Agronomia
Especialista en Manejo de Poscosecha de Granos,Naturales,Agronomia
Especialista en Manejo de Recursos Forestales,Naturales,Ambiente
Especialista en Manejo de Sistemas Pastoriles,Naturales,Ambiente
Especialista en Manejo de Suelos y Cultivos en Siembra Directa,Naturales,Agronomia
Especialista en Manejo Integrado de Plagas en Cultivos Extensivos,Naturales,Ambiente
"Especialista en Manejo Integrado de Plagas: Antropodos, Enfermedades y Malezas",Otros,Otros
Especialista en Mantenimiento,Otros,Otros
Especialista en Marketing,Comunicacion,Publicidad y Marketing
Especialista en Marketing de Servicios,Comunicacion,Publicidad y Marketing
Especialista en Marketing y Direccion Comercial,Comunicacion,Publicidad y Marketing
Especialista en Mastologia,Otros,Otros
Especialista en Matematica y sus Aplicaciones,Exactas,Matematica
Especialista en Materiales Explosivos,Ingenieria,Otros
Especialista en Mecanizacion Agricola,Naturales,Agronomia
Especialista en Mediacion,Juridicas,Abogacia
Especialista en Mediacion Educativa,Salud,Medicina
Especialista en Medicina Critica,Salud,Medicina
Especialista en Medicina Critica y Terapia Intensiva,Salud,Medicina
Especialista en Medicina de Familia,Salud,Medicina
Especialista en Medicina de Felinos Domesticos,Naturales,Veterinaria
Especialista en Medicina del Deporte,Salud,Medicina
Especialista en Medicina del Trabajo,Salud,Medicina
Especialista en Medicina Deportiva del Equino,Naturales,Veterinaria
Especialista en Medicina Familiar,Salud,Medicina
Especialista en Medicina Familiar - MD,Salud,Medicina
Especialista en Medicina Familiar y General,Salud,Medicina
Especialista en Medicina Felina,Naturales,Veterinaria
Especialista en Medicina Fisica y Rehabilitacion,Salud,Medicina
Especialista en Medicina General y Familiar,Salud,Medicina
Especialista en Medicina Interna,Salud,Medicina
Especialista en Medicina Legal,Salud,Medicina
Especialista en Medicina Social y Comunitaria,Salud,Medicina
Especialista en Medicina Transfusional,Salud,Medicina
"Especialista en Medicina, Higiene y Seguridad en el Trabajo",Salud,Otros
Especialista en Medio Ambiente Visual e Iluminacion Eficiente,Naturales,Ambiente
Especialista en Medios Alternativos de Resolucion de Conflictos,Otros,Otros
Especialista en Medios y Tecnologias para la Produccion Pictorica,Artes,Otros
Especialista en Mejoramiento Genetico Vegetal,Naturales,Biologia
Especialista en Mercado de Capitales,Economicas,Economia y Finanzas
Especialista en Mercadotecnia,Economicas,Economia y Finanzas
Especialista en Metodologia de Investigacion Cientifica,Sociales,Filosofia
Especialista en Metodologia de la Investigacion,Sociales,Filosofia
Especialista en Metodologia de la Investigacion en Ciencias de la Salud,Sociales,Filosofia
Especialista en Metodologia de la Investigacion en Ciencias Sociales,Otros,Otros
Especialista en Micologia y Parasitologia,Naturales,Biologia
Especialista en Microbiologia Clinica,Naturales,Biologia
Especialista en Microbiologia con orientacion en Bacteriologia,Otros,Otros
Especialista en Migracion y Asilo desde una perspectiva de Derechos Humanos - MD,Juridicas,Otros
Especialista en Ministerio Publico,Sociales,Ciencia Politica
Especialista en Modelado de Edificios con Informacion,Otros,Otros
Especialista en Municipio y Desarrollo Territorial,Arquitectura y Urbanismo,Urbanismo
"Especialista en Museos, Transmision Cultural y Manejo de Colecciones Antropologicas e Historicas",Otros,Otros
Especialista en Nefrologia,Salud,Medicina
Especialista en Negociacion,Economicas,Economia y Finanzas
Especialista en Negociaciones y Comercio Internacional en Agroindustrias,Economicas,Comercio Exterior
Especialista en Negocios Societarios,Economicas,Adm. Empresas
Especialista en Neonatologia,Salud,Medicina
Especialista en Neumonologia,Salud,Medicina
Especialista en Neurocirugia,Salud,Medicina
Especialista en Neurologia,Salud,Medicina
Especialista en Neurologia Cognitiva y Neuropsiquiatria,Salud,Medicina
Especialista en Neurologia Infantil,Salud,Medicina
Especialista en neuropsicologia,Psicologia,Psicologia
Especialista en Neuropsicologia Clinica,Psicologia,Psicologia
Especialista en Notariado,Juridicas,Abogacia
Especialista en Nuevas Infancias y Juventudes,Psicologia,Otros
Especialista en Nutricion,Salud,Nutricion
Especialista en Nutricion Animal,Naturales,Veterinaria
Especialista en Nutricion Clinica,Salud,Nutricion
Especialista en Nutricion Clinico-Metabolica,Salud,Nutricion
Especialista en Nutricion con Orientacion en Obesidad,Salud,Nutricion
Especialista en Nutricion Materno Infantil,Otros,Otros
Especialista en Nutricion Pediatrica,Salud,Nutricion
Especialista en Obstetricia,Salud,Medicina
Especialista en Odontologia Comunitaria y en Gestion de Sistemas y Servicios de Salud Bucal,Salud,Odontologia
Especialista en Odontologia Familiar y Comunitaria,Salud,Odontologia
Especialista en Odontologia General,Otros,Otros
Especialista en Odontologia Integral para personas con Riesgo Medico y Discapacidad,Otros,Otros
Especialista en Odontologia Legal,Salud,Odontologia
Especialista en Odontologia para Niños y Adolescentes,Salud,Odontologia
Especialista en Odontologia Restauradora,Salud,Odontologia
Especialista en Odontologia Restauradora (Operatoria Dental y Biomaterial),Salud,Odontologia
Especialista en Odontologia Social y Comunitaria,Salud,Odontologia
Especialista en Odontopediatria,Salud,Odontologia
Especialista en Oftalmologia,Salud,Medicina
Especialista en Oftalmologia Infantil,Salud,Medicina
Especialista en Olivicultura,Otros,Otros
Especialista en Oncologia,Salud,Medicina
Especialista en Oncologia Clinica,Salud,Medicina
Especialista en Oncologia Radioterapica,Salud,Medicina
Especialista en Operaciones de Comercio Exterior,Economicas,Comercio Exterior
Especialista en Operatoria y Estetica Dental,Salud,Odontologia
Especialista en Organizaciones sin Fines de Lucro,Economicas,Adm. Empresas
Especialista en Orientacion Educativa y Ocupacional,Psicologia,Psicologia
Especialista en Orientacion Vocacional y Educativa,Psicologia,Psicopedagogia
Especialista en Ortodoncia,Salud,Odontologia
Especialista en Ortodoncia y Ortopedia Dento-Maxilo-Facial,Salud,Odontologia
Especialista en Ortodoncia y Ortopedia Dentofacial,Salud,Odontologia
Especialista en Ortodoncia y Ortopedia Dentomaxilar,Salud,Odontologia
Especialista en Ortodoncia y Ortopedia Funcional,Salud,Odontologia
Especialista en Ortodoncia y Ortopedia Funcional de los Maxilares,Salud,Odontologia
Especialista en Ortodoncia y Ortopedia Maxilar,Salud,Odontologia
Especialista en Ortopedia y Traumatologia,Salud,Medicina
Especialista en Otorrinolaringologia,Salud,Medicina
Especialista en Paisajismo,Naturales,Otros
Especialista en Patologia,Salud,Medicina
Especialista en Patologia Medica,Salud,Otros
Especialista en Patologia y Control de Calidad de Estructuras Sismorresistentes,Otros,Otros
Especialista en Patologias de las Estructuras,Otros,Otros
Especialista en Patologias y Terapeuticas de la Construccion,Arquitectura y Urbanismo,Construcciones
Especialista en Pedagogia de la Formacion,Psicologia,Psicopedagogia
Especialista en Pedagogias para la Igualdad en Contextos Socioeducativos Diversos,Psicologia,Psicopedagogia
Especialista en Pediatria,Salud,Medicina
Especialista en Pediatria y Neonatologia,Salud,Medicina
Especialista en Pensamiento Nacional y Latinoamericano del Siglo XX,Otros,Otros
Especialista en Pericias y Tasaciones con mencion en Obras de Arquitectura y Urbanismo,Arquitectura y Urbanismo,Arquitectura
Especialista en Periodismo Cultural,Comunicacion,Periodismo
Especialista en Periodismo Digital,Comunicacion,Periodismo
Especialista en Periodismo Economico,Comunicacion,Periodismo
Especialista en Periodismo en Economia Politica,Economicas,Economia y Finanzas
Especialista en Periodismo Grafico,Otros,Otros
Especialista en Periodismo y Economia Politica,Comunicacion,Periodismo
Especialista en Periodoncia,Salud,Odontologia
Especialista en Peritaje de Pintura Argentina,Otros,Otros
Especialista en Peritajes Judiciales-Contables,Economicas,Contabilidad y Estadistica
Especialista en Pesca y Produccion Acuicola,Otros,Otros
Especialista en Pesquerias Marinas,Naturales,Ambiente
Especialista en Petroleo,Naturales,Geologia
Especialista en Planeamiento del Recurso Fisico en Salud,Otros,Otros
Especialista en Planeamiento del Recurso Fisico en Salud.,Salud,Otros
Especialista en Planeamiento Estrategico aplicado a las Finanzas y al Comercio Internacional,Otros,Otros
Especialista en Planeamiento Paisajista y Ambiente,Naturales,Otros
Especialista en Planeamiento Paisajista y Medio Ambiente,Otros,Otros
Especialista en Planeamiento Regional,Arquitectura y Urbanismo,Planeamiento
Especialista en Planeamiento y Gestion de Recursos Humanos de Organizaciones Militares Terrestres,Economicas,Adm. Empresas
Especialista en Planificacion de Infraestructura en Salud,Otros,Otros
Especialista en Planificacion del Paisaje,Naturales,Otros
Especialista en Planificacion e Intervencion para el Desarrollo,Sociales,Ciencia Politica
"Especialista en Planificacion Urbana - Regional, Orientacion Planificacion Regional Estrategica",Arquitectura y Urbanismo,Planeamiento
"Especialista en Planificacion Urbana - Regional, Orientacion Planificacion Urbana Participativa",Arquitectura y Urbanismo,Planeamiento
Especialista en Planificacion Urbana y Regional,Arquitectura y Urbanismo,Planeamiento
Especialista en Planificacion Urbana-Regional,Arquitectura y Urbanismo,Planeamiento
Especialista en Planificacion Urbano-Territorial,Arquitectura y Urbanismo,Planeamiento
Especialista en Planificacion y Diseño del Paisaje,Naturales,Otros
Especialista en Planificacion y Gestion de la Educacion,Educacion,Gestion Educativa
Especialista en Planificacion y Gestion de las Tecnologias de la Informacion,Economicas,Otros
Especialista en Planificacion y Gestion de Politicas Sociales,Sociales,Ciencia Politica
Especialista en Planificacion y Gestion de Recursos Materiales de Organizaciones Militares Terrestres,Sociales,Administracion Publica
Especialista en Planificacion y Gestion del Periodismo,Comunicacion,Periodismo
Especialista en Planificacion y Gestion Estrategica de Proyectos Educativos,Educacion,Otros
Especialista en Planificacion y Gestion Social,Sociales,Otros
"Especialista en Planificacion, Gestion y Evaluacion Estrategica de Instituciones Educativas",Educacion,Otros
Especialista en Plantas Medicinales,Naturales,Biologia
Especialista en Politica Sociales,Sociales,Ciencia Politica
Especialista en Politica y Gestion de la Ciencia y la Tecnologia,Sociales,Otros
Especialista en Politica y Gestion de la Educacion Superior,Educacion,Gestion Educativa
Especialista en Politica y Gestion de la Escuela Secundaria,Educacion,Gestion Educativa
Especialista en Politica y Gestion de la Salud Mental,Sociales,Otros
Especialista en Politica y Gestion de las Infraestructuras,Otros,Otros
Especialista en Politica y Gestion Universitaria,Educacion,Gestion Educativa
Especialista en Politica y Planificacion del Transporte,Economicas,Logistica y Transportes
"Especialista en Politica, Evaluacion y Gerencia Social",Sociales,Ciencia Politica
Especialista en Politicas Agroalimentarias,Economicas,Adm. Agraria
Especialista en Politicas de Infancias y Juventudes,Psicologia,Trabajo Social
Especialista en Politicas de Integracion,Sociales,Ciencia Politica
Especialista en Politicas de Migraciones Internacionales,Otros,Otros
Especialista en Politicas Educativas,Educacion,Gestion Educativa
Especialista en Politicas Publicas,Sociales,Ciencia Politica
"Especialista en Politicas Publicas de Niñez, Adolescencia y Familia",Sociales,Ciencia Politica
Especialista en Politicas Publicas de Seguridad,Sociales,Ciencia Politica
Especialista en Politicas Social,Otros,Otros
Especialista en Politicas Sociales,Sociales,Ciencia Politica
Especialista en Politicas Sociales Urbanas,Sociales,Ciencia Politica
Especialista en Politicas y Administracion en Salud Mental,Salud,Adm. Hospitalaria
Especialista en Practicas Gerontologicas,Otros,Otros
Especialista en Practicas Redaccionales,Comunicacion,Letras
Especialista en Practicas Sociales de Lectura y Escritura,Comunicacion,Letras
Especialista en Practicas Socioeducativas en el Nivel Secundario,Educacion,Otros
"Especialista en Practicas, Medios y Ambitos Educativo - Comunicacionales",Educacion,Otros
Especialista en Preparacion y Evaluacion de Proyectos,Otros,Otros
"Especialista en Preservacion, Conservacion y Reciclaje de Edificios de Valor Patrimonial",Arquitectura y Urbanismo,Planeamiento
Especialista en Prevencion de Riesgos Laborales,Salud,Otros
Especialista en Prevencion del Conflicto Juridico en la Pequeña y Mediana Empresa,Otros,Otros
Especialista en Prevencion y Asistencia Psicologica en Infancia y Niñez,Psicologia,Psicologia
"Especialista en Prevencion, Planificacion y Manejo Integrado de areas Propensas a Desastre",Otros,Otros
Especialista en Problematicas Sociales Infanto-Juveniles,Psicologia,Trabajo Social
Especialista en Problematicas Subjetivas del Contexto Juridico Forense,Psicologia,Psicologia
Especialista en Procedimiento Tributario y Previsional,Otros,Otros
"Especialista en Procedimiento Tributario, Previsional y Penal Tributario",Economicas,Contabilidad y Estadistica
Especialista en Procedimientos Tributarios y Ley Penal Tributaria y Previsional,Economicas,Contabilidad y Estadistica
Especialista en Procesos BioTecnologicos,Naturales,Biotecnologia
Especialista en Procesos Biotecnologicos,Otros,Otros
Especialista en Procesos de Lectura y Escritura,Comunicacion,Letras
Especialista en Procesos y Practicas de la Lectura y la Escritura,Educacion,Otros
Especialista en Procesos y Practicas de Produccion Artistica Contemporanea,Artes,Otros
Especialista en Produccion Animal,Naturales,Agronomia
Especialista en Produccion Avicola,Economicas,Adm. Agraria
Especialista en Produccion Bovina,Naturales,Agronomia
Especialista en Produccion de Cosmeticos,Otros,Cosmetologia
Especialista en Produccion de Cultivos Extensivos,Naturales,Agronomia
Especialista en Produccion de Petroleo y Gas,Naturales,Geologia
"Especialista en Produccion de Semillas de Cereales, Oleaginosas y Forrajeras",Naturales,Agronomia
Especialista en Produccion de Textos Criticos y de Difusion Mediatica de las Artes,Artes,Otros
Especialista en Produccion Ganadera de Zonas aridas,Naturales,Agronomia
Especialista en Produccion Lechera,Naturales,Agronomia
Especialista en Produccion Vegetal,Naturales,Agronomia
Especialista en Produccion y Analisis de Informacion para Politicas Publicas,Sociales,Ciencia Politica
Especialista en Produccion y Gestion de Obras,Otros,Otros
Especialista en Produccion y Sanidad Porcina,Otros,Otros
Especialista en Produccion y Tratamiento de Gas Natural,Naturales,Geologia
Especialista en Producciones Ecologicas de Origen Animal,Otros,Otros
Especialista en Productividad Organizacional,Economicas,Adm. Industrial
Especialista en Programacion y Evaluacion del Ejercicio,Otros,Educacion Fisica y Deportes
Especialista en Prospectiva Estrategica,Naturales,Otros
Especialista en Prospectiva Estrategica - MD,Otros,Otros
Especialista en Prostodoncia,Salud,Odontologia
"Especialista en Proteccion de Derechos de Niños, Niñas y Adolescentes",Juridicas,Abogacia
Especialista en Proteccion Radiologica y Seguridad de las Fuentes de Radiacion,Ingenieria,Energia
Especialista en Proteccion Vegetal,Naturales,Agronomia
Especialista en Protesis,Salud,Medicina
Especialista en Protesis Bucal y Rehabilitacion Integral Implantoasistida,Otros,Otros
Especialista en Protesis Dentobucomaxilar,Salud,Odontologia
Especialista en Protesis Dentobucomaxilar y Rehabilitacion Integral Implantoasistida,Salud,Odontologia
"Especialista en Protesis Fija, Removible e Implantologia",Salud,Odontologia
"Especialista en Protesis, Ortesis y Productos Biomedicos",Salud,Medicina
Especialista en Proyecto Urbano,Arquitectura y Urbanismo,Urbanismo
"Especialista en Proyecto, Planificacion y Gestion de Arquitectura para la Educacion",Arquitectura y Urbanismo,Planeamiento
Especialista en Proyectos Urbanos,Arquitectura y Urbanismo,Urbanismo
Especialista en Psico-Oncologia,Psicologia,Psicologia
Especialista en Psicoanalisis,Psicologia,Psicologia
Especialista en Psicoanalisis con Adolescentes,Psicologia,Psicologia
Especialista en Psicoanalisis con Niños,Psicologia,Psicologia
Especialista en Psicoanalisis con Orientacion Clinica en Adolescentes,Psicologia,Psicologia
Especialista en Psicoanalisis con Orientacion Clinica en Adultos,Psicologia,Psicologia
Especialista en Psicoanalisis con Orientacion Clinica en Familia y Pareja,Psicologia,Psicologia
Especialista en Psicoanalisis con Orientacion Clinica en Grupos,Psicologia,Psicologia
Especialista en Psicoanalisis con Orientacion Clinica en Niños,Psicologia,Psicologia
Especialista en Psicoanalisis de Niños y Adolescentes,Psicologia,Psicologia
Especialista en Psicodiagnostico,Psicologia,Psicologia
Especialista en Psicogeriatria,Psicologia,Psicologia
Especialista en Psicogerontologia,Psicologia,Psicologia
Especialista en Psicogerontologia - MD,Psicologia,Psicologia
Especialista en Psicologia Clinica,Psicologia,Psicologia
Especialista en Psicologia Clinica Asistencia Infantil,Psicologia,Psicologia
Especialista en Psicologia Clinica con Orientacion Psicoanalitica,Psicologia,Psicologia
Especialista en Psicologia Clinica con orientacion Psicoanalitica,Psicologia,Psicologia
Especialista en Psicologia Clinica con orientacion Sistemica,Psicologia,Psicologia
Especialista en Psicologia Clinica de la Discapacidad,Psicologia,Psicologia
Especialista en Psicologia Clinica de Niños y Adolescentes,Psicologia,Psicologia
Especialista en Psicologia Clinica de Niños y Adolescentes (Orientacion Psicoanalitica),Psicologia,Psicologia
"Especialista en Psicologia Clinica de Niños, Adolescentes y Familias",Psicologia,Psicologia
Especialista en Psicologia Clinica y Terapia Cognitiva,Psicologia,Psicologia
Especialista en Psicologia Clinica y Terapia Cognitivo-Conductual,Psicologia,Psicologia
"Especialista en Psicologia Clinica, Institucional y Comunitaria",Psicologia,Psicologia
Especialista en Psicologia con Orientacion en Procesos de Aprendizaje del Lenguaje Escrito y sus Trastornos,Psicologia,Psicologia
Especialista en Psicologia de la Niñez y Adolescencia,Psicologia,Psicologia
Especialista en Psicologia del Aprendizaje,Psicologia,Psicologia
Especialista en Psicologia del Trabajo y de las Organizaciones,Psicologia,Psicologia
Especialista en Psicologia del Trabajo y las Organizaciones,Psicologia,Psicologia
Especialista en Psicologia Educacional,Psicologia,Psicologia
Especialista en Psicologia Educacional con Orientacion en Procesos de Aprendizaje del Lenguaje Escrito y sus Trastornos,Psicologia,Psicologia
Especialista en Psicologia Educacional con orientacion en Procesos de Aprendizaje del Lenguaje Escrito y sus Trastornos,Educacion,Otros
Especialista en Psicologia en Educacion,Psicologia,Psicologia
Especialista en Psicologia Forense,Psicologia,Psicologia
Especialista en Psicologia Juridica,Psicologia,Psicologia
Especialista en Psicologia Organizacional y del Trabajo,Psicologia,Psicologia
Especialista en Psicologia Politica y Economica,Economicas,Economia y Finanzas
Especialista en Psicologia Sanitaria,Psicologia,Psicologia
Especialista en Psicologia Social Comunitaria,Psicologia,Psicologia
Especialista en Psicologia Vincular de Familias con Niños y Adolescentes,Psicologia,Psicologia
Especialista en Psicologia y Psicoanalisis de los Vinculos,Psicologia,Psicologia
Especialista en Psicopatologia y Salud Mental,Psicologia,Psicologia
Especialista en Psicopedagogia,Psicologia,Psicopedagogia
Especialista en Psicopedagogia Clinica,Psicologia,Psicopedagogia
Especialista en Psicopedagogia Escolar,Psicologia,Psicopedagogia
Especialista en Psicopedagogia Institucional,Otros,Otros
Especialista en Psicoterapia cognitiva,Psicologia,Psicologia
Especialista en Psicoterapia Familiar con Orientacion Cognitiva,Psicologia,Psicologia
Especialista en Psicoterapia Individual y Grupal,Psicologia,Psicologia
Especialista en Psiquiatria,Salud,Medicina
Especialista en Psiquiatria Infanto Juvenil,Salud,Medicina
Especialista en Psiquiatria y Psicologia Medica,Salud,Medicina
Especialista en Quimica Ambiental,Exactas,Quimica
Especialista en Quimica Clinica,Salud,Bioquimica y Farmacia
Especialista en Radiologia y Diagnostico por Imagenes,Salud,Radiologia y Diagnostico por Imagenes
Especialista en Radiologia y Medicina por Imagenes,Salud,Radiologia y Diagnostico por Imagenes
Especialista en Radioquimica y Aplicaciones Nucleares,Ingenieria,Energia
