carrera,carrera_grupo,Carrera_normalizada
Licenciatura en Periodismo - Ciclo de Complementacion Curricular,Sociales,Otros
Licenciatura en Periodismo - Ciclo de Complementacion Curricular - MD,Comunicacion,Periodismo
Licenciatura en Periodismo - Ciclo de Licenciatura,Comunicacion,Periodismo
Licenciatura en Periodismo - MD,Comunicacion,Periodismo
Licenciatura en Periodismo con Orientacion Audiovisual,Comunicacion,Periodismo
Licenciatura en Periodismo con Orientacion Grafica,Comunicacion,Periodismo
Licenciatura en Periodismo y Comunicacion - Ciclo de Licenciatura,Comunicacion,Periodismo
Licenciatura en Periodismo y Comunicacion - Ciclo de Licenciatura - MD,Comunicacion,Periodismo
Licenciatura en Periodismo y Comunicaciones,Comunicacion,Periodismo
Licenciatura en Periodismo y Nuevos Medios,Comunicacion,Periodismo
Licenciatura en Periodismo y Nuevos Medios - MD,Comunicacion,Periodismo
Licenciatura en Peritaje y Valuacion de Obras de Arte,Artes,Visuales
Licenciatura en Piano,Artes,Musica
Licenciatura en Piano de Camara,Otros,Otros
Licenciatura en Pintura,Artes,Visuales
Licenciatura en Planificacion Logistica,Economicas,Logistica y Transportes
Licenciatura en Planificacion Logistica - Ciclo de Licenciatura,Economicas,Logistica y Transportes
Licenciatura en Planificacion y Diseño del Paisaje,Naturales,Otros
Licenciatura en Plantas Propulsoras Marinas,Naturales,Agronomia
Licenciatura en Podologia - Ciclo de Licenciatura,Salud,Otros
Licenciatura en Politica Social,Sociales,Ciencia Politica
Licenciatura en Politica y Administracion de la Cultura - MD,Sociales,Ciencia Politica
Licenciatura en Politica y Administracion Publica,Sociales,Ciencia Politica
Licenciatura en Politicas Publicas y Gobierno,Sociales,Ciencia Politica
Licenciatura en Portugues,Comunicacion,Idiomas Extranjeros
Licenciatura en Post-Produccion Audiovisual - Ciclo de Licenciatura,Artes,Audiovisuales
Licenciatura en Prevencion Vial y Transporte,Economicas,Logistica y Transportes
Licenciatura en Procesos Productivos con Orientacion en Automacion y Robotica - Ciclo de Licenciatura,Ingenieria,Otros
Licenciatura en Produccion Agropecuaria,Naturales,Agronomia
Licenciatura en Produccion Agropecuaria - Ciclo de Complementacion Curricular,Naturales,Agronomia
Licenciatura en Produccion Animal,Naturales,Agronomia
Licenciatura en Produccion de Bioimagenes,Salud,Radiologia y Diagnostico por Imagenes
Licenciatura en Produccion de Bioimagenes - Ciclo de Complementacion Curricular,Otros,Otros
Licenciatura en Produccion de Bioimagenes - Ciclo de Licenciatura,Salud,Radiologia y Diagnostico por Imagenes
Licenciatura en Produccion de Radio y Television,Comunicacion,Periodismo
Licenciatura en Produccion Integral de Radio y Television,Artes,Audiovisuales
Licenciatura en Produccion Multimedial con orientacion: Audiovisual,Otros,Otros
Licenciatura en Produccion Multimedial con orientacion: Sonido,Otros,Otros
Licenciatura en Produccion Multimedial con orientacion: Visual,Otros,Otros
Licenciatura en Produccion Vegetal,Naturales,Agronomia
"Licenciatura en Produccion y Direccion de Television, Cine y Radio",Artes,Audiovisuales
Licenciatura en Produccion y Direccion Radial y Televisiva,Comunicacion,Periodismo
Licenciatura en Produccion y Gestion Agropecuaria,Economicas,Adm. Agraria
Licenciatura en Produccion y Gestion de las Artes Visuales - Ciclo de Licenciatura,Artes,Visuales
Licenciatura en Produccion y Realizacion Audiovisual,Artes,Audiovisuales
Licenciatura en Proteccion Civil y Emergencias,Juridicas,Otros
Licenciatura en Proteccion Civil y Emergencias - MD,Juridicas,Otros
Licenciatura en Proteccion y Saneamiento Ambiental,Naturales,Ambiente
Licenciatura en Psicologia,Psicologia,Psicologia
Licenciatura en Psicologia - Ciclo de Licenciatura,Psicologia,Psicologia
Licenciatura en Psicologia Aplicada,Psicologia,Psicologia
Licenciatura en Psicologia Organizacional,Psicologia,Psicologia
Licenciatura en Psicologia Social,Psicologia,Psicologia
Licenciatura en Psicomotricidad,Educacion,Especial
Licenciatura en Psicomotricidad - Ciclo de Licenciatura,Educacion,Especial
Licenciatura en Psicomotricidad Educativa - Ciclo de Licenciatura,Educacion,Especial
Licenciatura en Psicopedagogia,Psicologia,Psicopedagogia
Licenciatura en Psicopedagogia - 4 1/2 años,Psicologia,Psicopedagogia
Licenciatura en Psicopedagogia - 4a,Psicologia,Psicopedagogia
Licenciatura en Psicopedagogia - Ciclo de Complementacion Curricular,Otros,Otros
Licenciatura en Psicopedagogia - Ciclo de Licenciatura,Psicologia,Psicopedagogia
Licenciatura en Psicopedagogia - Ciclo de Licenciatura - MD,Psicologia,Psicopedagogia
Licenciatura en Psicopedagogia Especializado en ReEducacion,Psicologia,Psicopedagogia
Licenciatura en Psicopedagogia Especializado en Reeducacion,Educacion,Otros
Licenciatura en Publicidad,Comunicacion,Publicidad y Marketing
Licenciatura en Publicidad - 4 años,Comunicacion,Publicidad y Marketing
Licenciatura en Publicidad - Ciclo de Licenciatura,Comunicacion,Publicidad y Marketing
Licenciatura en Publicidad - MD,Comunicacion,Publicidad y Marketing
Licenciatura en Quimica,Exactas,Quimica
Licenciatura en Quimica - Ciclo Licenciatura,Exactas,Quimica
Licenciatura en Quimica Farmaceutica,Exactas,Quimica
Licenciatura en Quimica Industrial,Exactas,Quimica
Licenciatura en Quimica Orientacion Agricola,Exactas,Quimica
Licenciatura en Quimica orientacion Agricola,Otros,Otros
Licenciatura en Quimica y Tecnologia Ambiental,Exactas,Quimica
Licenciatura en Radiologia e Imagenes - Ciclo de Licenciatura,Otros,Otros
Licenciatura en Realizacion Audiovisual,Artes,Audiovisuales
Licenciatura en Recursos Humanos,Sociales,Recursos Humanos
Licenciatura en Recursos Humanos - Ciclo de Complementacion Curricular - MD,Sociales,Recursos Humanos
Licenciatura en Recursos Humanos - MD,Sociales,Recursos Humanos
Licenciatura en Recursos Humanos con Orientacion en Desarrollo Organizacional,Sociales,Recursos Humanos
Licenciatura en Recursos Humanos- Ciclo de Licenciatura,Sociales,Recursos Humanos
Licenciatura en Recursos Naturales,Naturales,Ambiente
Licenciatura en Recursos Navales para la Defensa con Orientacion alternativa en Comando Infanteria de Marina,Otros,Otros
Licenciatura en Recursos Navales para la Defensa con Orientacion alternativa en Comando Naval,Otros,Otros
Licenciatura en Recursos Navales para la Defensa con Orientacion Comando Infanteria de Marina,Otros,Otros
Licenciatura en Recursos Navales para la Defensa con Orientacion Comando Naval,Otros,Otros
Licenciatura en Redes de Comunicaciones,Informatica,Otros
Licenciatura en Redes y Comunicacion de Datos,Informatica,Otros
Licenciatura en Redes y Comunicacion de Datos - Ciclo de Complementacion Curricular,Otros,Otros
Licenciatura en Rehabilitacion Visual - Ciclo de Complementacion Curricular,Salud,Otros
Licenciatura en Relaciones Comerciales Internacionales,Economicas,Comercio Exterior
Licenciatura en Relaciones Comerciales Internacionales - MD,Otros,Otros
Licenciatura en Relaciones del Trabajo,Sociales,Recursos Humanos
Licenciatura en Relaciones Humanas,Sociales,Recursos Humanos
Licenciatura en Relaciones Industriales,Otros,Otros
Licenciatura en Relaciones Institucionales,Comunicacion,Relaciones Publicas
Licenciatura en Relaciones Internacionales,Sociales,Relaciones Internacionales
Licenciatura en Relaciones Internacionales - MD,Sociales,Relaciones Internacionales
"Licenciatura en Relaciones Internacionales con Orientacion en Escenarios de Conflictos Internacionales, Misiones de Paz y Desarme -",Sociales,Relaciones Internacionales
Licenciatura en Relaciones Laborales,Sociales,Recursos Humanos
Licenciatura en Relaciones Laborales - 4 años,Sociales,Recursos Humanos
Licenciatura en Relaciones Laborales - Ciclo de Licenciatura,Sociales,Recursos Humanos
Licenciatura en Relaciones Laborales - MD,Otros,Otros
Licenciatura en Relaciones Publicas,Comunicacion,Relaciones Publicas
Licenciatura en Relaciones Publicas - 4 años,Comunicacion,Relaciones Publicas
Licenciatura en Relaciones Publicas - Ciclo de Licenciatura,Comunicacion,Relaciones Publicas
Licenciatura en Relaciones Publicas - MD,Comunicacion,Relaciones Publicas
Licenciatura en Relaciones Publicas e Institucionales,Comunicacion,Relaciones Publicas
Licenciatura en Relaciones Publicas e Institucionales - MD,Comunicacion,Relaciones Publicas
Licenciatura en Resolucion de Conflictos y Mediacion - Ciclo de Licenciatura,Juridicas,Abogacia
Licenciatura en Resolucion de Conflictos y Mediacion - Ciclo de Licenciatura - MD,Sociales,Relaciones Internacionales
Licenciatura en Salud Ambiental,Otros,Otros
Licenciatura en Saneamiento Ambiental,Naturales,Ambiente
Licenciatura en Saneamiento y Proteccion Ambiental,Naturales,Ambiente
Licenciatura en Saxofon,Artes,Musica
Licenciatura en Seguridad,Otros,Higiene y Seguridad Industrial
Licenciatura en Seguridad - Ciclo de Complementacion Curricular,Otros,Otros
Licenciatura en Seguridad - Ciclo de Complementacion Curricular - MD,Sociales,Ciencia Politica
Licenciatura en Seguridad - Ciclo de Licenciatura,Otros,Higiene y Seguridad Industrial
Licenciatura en Seguridad - MD,Otros,Otros
Licenciatura en Seguridad Ciudadana,Juridicas,Otros
Licenciatura en Seguridad Ciudadana - Ciclo de Licenciatura,Juridicas,Otros
Licenciatura en Seguridad Ciudadana - Ciclo de Licenciatura - MD,Juridicas,Abogacia
Licenciatura en Seguridad Ciudadana - Modalidad a distancia - Ciclo de Complementacion Curricular,Juridicas,Abogacia
Licenciatura en Seguridad en Tecnologias de la Informacion y Comunicaciones,Informatica,Otros
Licenciatura en Seguridad Maritima,Ingenieria,Naval
Licenciatura en Seguridad Penitenciaria,Juridicas,Abogacia
Licenciatura en Seguridad Publica,Juridicas,Otros
Licenciatura en Seguridad Publica - Ciclo de Licenciatura,Juridicas,Otros
Licenciatura en Seguridad Publica y Ciudadana - Ciclo de Complementacion Curricular,Juridicas,Abogacia
Licenciatura en Seguridad y Salud Ocupacional - Ciclo de Licenciatura,Salud,Otros
"Licenciatura en Seguridad, Higiene y Control Ambiental Laboral",Otros,Higiene y Seguridad Industrial
Licenciatura en Seguros,Economicas,Actuariales
Licenciatura en Servicio Social,Sociales,Servicio Social
Licenciatura en Servicio Social - Ciclo de Licenciatura,Sociales,Servicio Social
Licenciatura en Sistema de Proteccion Contra Siniestros,Juridicas,Otros
Licenciatura en Sistemas,Informatica,Lic.Sistemas/Informatica
Licenciatura en Sistemas,Informatica,Lic.Sistemas/Informatica
Licenciatura en Sistemas - Ciclo de Licenciatura,Informatica,Lic.Sistemas/Informatica
Licenciatura en Sistemas - Ciclo de Licenciatura,Informatica,Lic.Sistemas/Informatica
Licenciatura en Sistemas (con Orientacion Calidad del Software),Informatica,Lic.Sistemas/Informatica
Licenciatura en Sistemas (Orientacion Calidad de Software),Informatica,Lic.Sistemas/Informatica
Licenciatura en Sistemas (orientacion Calidad de Software),Informatica,Lic.Sistemas/Informatica
Licenciatura en Sistemas de Informacion,Informatica,Sistemas de Informacion
Licenciatura en Sistemas de Informacion,Informatica,Sistemas de Informacion
Licenciatura en Sistemas de Informacion - Ciclo de Licenciatura,Informatica,Sistemas de Informacion
Licenciatura en Sistemas de Informacion - Ciclo de Licenciatura,Informatica,Sistemas de Informacion
Licenciatura en Sistemas de Informacion de las Organizaciones,Informatica,Sistemas de Informacion
Licenciatura en Sistemas de Informacion Geografica,Informatica,Otros
Licenciatura en Sistemas Informaticos,Informatica,Lic.Sistemas/Informatica
Licenciatura en Sistemas Informaticos,Informatica,Lic.Sistemas/Informatica
Licenciatura en Sistemas Navales,Otros,Otros
Licenciatura en Sistemas Navales Aereos,Otros,Otros
Licenciatura en Sistemas Navales de Infanteria de Marina,Otros,Otros
Licenciatura en Sistemas y Computacion,Informatica,Lic.Sistemas/Informatica
Licenciatura en Sistemas y Computacion,Informatica,Lic.Sistemas/Informatica
Licenciatura en Sistemas y Gestion,Informatica,Otros
Licenciatura en Sociologia,Sociales,Sociologia
Licenciatura en Sociologia - MD,Sociales,Sociologia
Licenciatura en Sonorizacion y Grabacion,Artes,Audiovisuales
"Licenciatura en Tasacion, Correduria y Gestion de Bienes",Juridicas,Otros
"Licenciatura en Tasacion, Correduria y Gestion de Bienes - MD",Juridicas,Otros
Licenciatura en Teatro,Artes,Teatro y Danza
Licenciatura en Teatro - Ciclo de Licenciatura,Artes,Teatro y Danza
Licenciatura en Teatro Orientacion Actoral,Artes,Teatro y Danza
Licenciatura en Teatro Orientacion Escenografica,Artes,Teatro y Danza
Licenciatura en Tecnologia,Otros,Otros
Licenciatura en Tecnologia Ambiental,Naturales,Ambiente
Licenciatura en Tecnologia Aplicada a la Seguridad - Ciclo de Licenciatura,Otros,Otros
Licenciatura en Tecnologia de Alimentos,Naturales,Alimentos
Licenciatura en Tecnologia de la Informacion,Ingenieria,Telecomunicaciones
Licenciatura en Tecnologia de la Informacion-Ciclo de Complementacion Curricular,Informatica,Lic.Sistemas/Informatica
Licenciatura en Tecnologia de las Comunicaciones,Ingenieria,Telecomunicaciones
Licenciatura en Tecnologia de los Alimentos,Naturales,Alimentos
Licenciatura en Tecnologia de los Alimentos - Mencion Industrializacion de Alimentos de Origen Vegetal,Naturales,Alimentos
Licenciatura en Tecnologia de los Alimentos - mencion Industrializacion de Alimentos de Origen Vegetal,Otros,Otros
Licenciatura en Tecnologia de los Alimentos - Mencion Produccion de Materia Prima de Origen Vegetal,Naturales,Alimentos
Licenciatura en Tecnologia de los Alimentos - mencion Produccion de Materia Prima de Origen Vegetal,Otros,Otros
Licenciatura en Tecnologia de los Alimentos - Mencion Tecnologia de los Alimentos de Origen Animal,Naturales,Alimentos
Licenciatura en Tecnologia de los Alimentos - mencion Tecnologia de los Alimentos de Origen Animal,Otros,Otros
Licenciatura en Tecnologia e Instrumentacion Biomedica - Ciclo de Licenciatura,Salud,Medicina
Licenciatura en Tecnologia Educativa,Educacion,Tecnologia Educativa
Licenciatura en Tecnologia Educativa - Ciclo de Licenciatura,Educacion,Tecnologia Educativa
Licenciatura en Tecnologia Educativa - Ciclo de Licenciatura - MD,Educacion,Tecnologia Educativa
Licenciatura en Tecnologia Electromecanica,Ingenieria,Electromecanica
Licenciatura en Tecnologia Industrial de los Alimentos,Naturales,Alimentos
Licenciatura en Tecnologia Informatica,Informatica,Otros
Licenciatura en Tecnologia Medica - Ciclo de Licenciatura,Otros,Otros
Licenciatura en Tecnologia Minera,Otros,Otros
Licenciatura en Tecnologia Multimedial,Artes,Digitales y Multimedia
Licenciatura en Tecnologia para Diagnostico por Imagenes,Salud,Radiologia y Diagnostico por Imagenes
Licenciatura en Tecnologia para Diagnostico por Imagenes - Ciclo de Licenciatura,Salud,Radiologia y Diagnostico por Imagenes
Licenciatura en Tecnologias Aplicadas al Arte Sonoro,Artes,Musica
Licenciatura en Tecnologias de Comunicacion Educativa - Ciclo de Licenciatura,Educacion,Tecnologia Educativa
Licenciatura en Tecnologias de la Informacion,Otros,Otros
Licenciatura en Tecnologias de la Informacion y Comunicacion,Otros,Otros
Licenciatura en Tecnologias Digitales para la Educacion - Ciclo de Complementacion Curricular - MD,Educacion,Tecnologia Educativa
Licenciatura en Tecnologias Ferroviarias,Otros,Otros
Licenciatura en Telecomunicaciones,Ingenieria,Telecomunicaciones
Licenciatura en Television - Ciclo de Licenciatura,Sociales,Otros
Licenciatura en Teologia,Sociales,Teologia
Licenciatura en Teologia - Ciclo de Licenciatura,Otros,Otros
Licenciatura en Teologia con Orientacion en Teologia Moral,Sociales,Teologia
Licenciatura en Teologia con orientacion en Teologia Moral,Otros,Otros
Licenciatura en Teologia especializacion en Historia de la Iglesia,Sociales,Teologia
Licenciatura en Teologia especializacion en Sagrada Escritura,Sociales,Teologia
Licenciatura en Teologia especializacion en Teologia Dogmatica,Sociales,Teologia
Licenciatura en Teologia especializacion en Teologia Pastoral,Sociales,Teologia
Licenciatura en Teologia Pastoral,Sociales,Teologia
Licenciatura en Teologia y Religiones Comparadas,Sociales,Teologia
Licenciatura en Teoria y Critica de la Musica - Ciclo de Licenciatura - MD,Artes,Musica
Licenciatura en Terapia del Lenguaje,Salud,Fonoaudiologia
Licenciatura en Terapia Fisica,Salud,Otros
Licenciatura en Terapia Ocupacional,Salud,Otros
Licenciatura en Terapia Ocupacional - Ciclo de Licenciatura,Salud,Otros
Licenciatura en Terapia Ocupacional - Ciclo de Licenciatura - MD,Salud,Otros
Licenciatura en Terapia Ocupacional (Disp.07/05 - 4 años),Salud,Otros
Licenciatura en Tiempo Libre para el Deporte y el Turismo - Ciclo de Licenciatura,Otros,Educacion Fisica y Deportes
Licenciatura en Tiempo Libre y Recreacion - Ciclo de Licenciatura,Otros,Otros
Licenciatura en Trabajo Social,Psicologia,Trabajo Social
Licenciatura en Trabajo Social - Ciclo de Complementacion Curricular,Psicologia,Trabajo Social
Licenciatura en Trabajo Social - Ciclo de Licenciatura,Psicologia,Trabajo Social
Licenciatura en Trabajo Social - Ciclo de Licenciatura - MD,Psicologia,Trabajo Social
Licenciatura en Transporte Maritimo,Economicas,Logistica y Transportes
Licenciatura en Transportes y Logistica Operativa,Economicas,Logistica y Transportes
Licenciatura en Tratamiento Penitenciario,Juridicas,Abogacia
Licenciatura en Tratamiento y Analisis de Datos para la Investigacion Socio-Economica - Ciclo de Licenciatura,Economicas,Economia y Finanzas
Licenciatura en Trombon,Artes,Musica
Licenciatura en Trompa,Artes,Musica
Licenciatura en Trompeta,Artes,Musica
Licenciatura en Tuba,Artes,Musica
Licenciatura en Turismo,"Hoteleria, Gastronomia y Turismo",Turismo
Licenciatura en Turismo - Ciclo de Complementacion Curricular,"Hoteleria, Gastronomia y Turismo",Turismo
Licenciatura en Turismo - Ciclo de Licenciatura,"Hoteleria, Gastronomia y Turismo",Turismo
Licenciatura en Turismo - Ciclo de Licenciatura - MD,"Hoteleria, Gastronomia y Turismo",Turismo
Licenciatura en Turismo - MD,"Hoteleria, Gastronomia y Turismo",Turismo
Licenciatura en Turismo Cultural - Ciclo de Licenciatura,"Hoteleria, Gastronomia y Turismo",Turismo
Licenciatura en Turismo Ecologico,"Hoteleria, Gastronomia y Turismo",Turismo
Licenciatura en Turismo Sustentable - Ciclo de Licenciatura,"Hoteleria, Gastronomia y Turismo",Turismo
Licenciatura en Turismo y Desarrollo Local,"Hoteleria, Gastronomia y Turismo",Turismo
Licenciatura en Turismo y Hoteleria,"Hoteleria, Gastronomia y Turismo",Turismo y Hoteleria
Licenciatura en Turismo y Hoteleria,"Hoteleria, Gastronomia y Turismo",Turismo
Licenciatura en Turismo y Hoteleria - Ciclo de Licenciatura - MD,"Hoteleria, Gastronomia y Turismo",Turismo y Hoteleria
Licenciatura en Turismo y Hoteleria - MD,"Hoteleria, Gastronomia y Turismo",Turismo y Hoteleria
Licenciatura en Urbanismo,Arquitectura y Urbanismo,Urbanismo
Licenciatura en Viola,Artes,Musica
Licenciatura en Violin,Artes,Musica
Licenciatura en Violoncello,Artes,Musica
Licenciatura en Violoncelo,Artes,Musica
Licenciatura en Zoologia,Naturales,Biologia
Licenciatura enBiotecnologia,Naturales,Biologia
Licenciatura enBiotecnologia y Biologia Molecular,Naturales,Biologia
Licenciatura Fonoaudiologo,Salud,Fonoaudiologia
Licenciatura Kinesiologo-Fisiatra,Salud,Kinesiologia
Licenciatura Obstetrico,Salud,Medicina
Licenciatura y Profesor en Historia,Sociales,Historia y Geografia
Licenciatura y/o Profesor en Ciencias de la Educacion,Educacion,Cs. Educacion
Licenciatura y/o Profesor en Filosofia,Sociales,Filosofia
Licenciatura y/o Profesor en Frances,Educacion,Otros
Licenciatura y/o Profesor en Geografia,Educacion,Otros
Licenciatura y/o Profesor en Historia,Sociales,Historia y Geografia
Licenciatura y/o Profesor en Ingles,Educacion,Otros
Licenciatura y/o Profesor en Letras,Comunicacion,Letras
Licenciatura/a en Ciencias Agrarias,Naturales,Agronomia
Licenciatura/a en Enfermeria,Otros,Otros
Licenciatura/a en Enologia,Otros,Otros
Licenciatura/a en Hoteleria,"Hoteleria, Gastronomia y Turismo",Hoteleria
Licenciatura/a en Podologia - Ciclo de Complementacion Curricular,Otros,Otros
Licenciatura/a en Psicopedagogia - Ciclo de Complementacion Curricular,Otros,Otros
Licenciatura/a en Recursos Humanos,Otros,Otros
Licenciatura/a en Turismo,"Hoteleria, Gastronomia y Turismo",Turismo
Locutor Nacional,Comunicacion,Periodismo
Locutor Nacional de Radio y Television,Comunicacion,Periodismo
Locutor Nacional Universitaria,Comunicacion,Periodismo
Locutor Nacional Universitaria - T.I.,Comunicacion,Periodismo
Locutor Nacional Universitario,Otros,Otros
Locutor Nacional Universitario - T.I.,Otros,Otros
Maestria en Ciencias Sociales con Mencion en Metodologia de la Investigacion Social y Mencion en Politicas Sociales,Sociales,Sociologia
Maestria en Critica y Difusion de las Artes,Artes,Audiovisuales
Maestria en Derechos Humanos,Juridicas,Abogacia
Maestria en Seguridad Publica,Juridicas,Otros
Maestro de Educacion Fisica,Otros,Educacion Fisica y Deportes
Maestro de Educacion Fisica y Deporte Infantil (Lic.en EF 5 años),Otros,Educacion Fisica y Deportes
Maestro de Expresion Plastica,Artes,Visuales
Maestro en Educacion Fisica,Educacion,Otros
Magister de la Universidad de Buenos Aires en Administracion,Economicas,Adm. Empresas
Magister de la Universidad de Buenos Aires en Administracion Cultural,Sociales,Gestion Cultural
Magister de la Universidad de Buenos Aires en Administracion de Empresas de Base Tecnologica,Economicas,Adm. Empresas
Magister de la Universidad de Buenos Aires en Administracion de Organizaciones del Sector Cultural y Creativo,Economicas,Adm. Empresas
Magister de la Universidad de Buenos Aires en Administracion de Organizaciones del Sector Cultural y Creativo - MD,Otros,Otros
Magister de la Universidad de Buenos Aires en Administracion de Organizaciones del Sector Cultural y Creativo con Orientacion en A,Sociales,Gestion Cultural
Magister de la Universidad de Buenos Aires en Administracion de Organizaciones del Sector Cultural y Creativo con orientacion en Artes Escenicas,Artes,Otros
Magister de la Universidad de Buenos Aires en Administracion de Organizaciones del Sector Cultural y Creativo con orientacion en Emprendimientos Audiovisuales,Otros,Otros
Magister de la Universidad de Buenos Aires en Administracion de Organizaciones del Sector Cultural y Creativo con Orientacion en P,Sociales,Gestion Cultural
Magister de la Universidad de Buenos Aires en Administracion de Organizaciones del Sector Cultural y Creativo con orientacion en Patrimonio y Artes Visuales,Artes,Otros
Magister de la Universidad de Buenos Aires en Administracion de Organizaciones en el Sector Cultural y Creativo,Sociales,Gestion Cultural
Magister de la Universidad de Buenos Aires en Administracion de Sistemas y Servicios de Salud,Salud,Adm. Hospitalaria
Magister de la Universidad de Buenos Aires en Administracion Publica,Sociales,Administracion Publica
Magister de la Universidad de Buenos Aires en Agronegocios y Alimentos,Economicas,Adm. Agraria
Magister de la Universidad de Buenos Aires en Analisis del Discurso,Comunicacion,Periodismo
"Magister de la Universidad de Buenos Aires en Anatomia Quirurgica, en Ginecologia y Mastologia",Otros,Otros
Magister de la Universidad de Buenos Aires en Antropologia Social,Sociales,Antropologia
Magister de la Universidad de Buenos Aires en Automatizacion Industrial,Otros,Otros
Magister de la Universidad de Buenos Aires en Bibliotecologia y Ciencia de la Informacion,Otros,Bibliotecologia y Documentacion
Magister de la Universidad de Buenos Aires en Biologia Molecular Medica,Naturales,Biologia
Magister de la Universidad de Buenos Aires en Bromatologia y Tecnologia de la Industrializacion de Alimentos,Salud,Bromatologia
Magister de la Universidad de Buenos Aires en Cardiologia Veterinaria,Otros,Otros
Magister de la Universidad de Buenos Aires en Ciberdefensa y Ciberseguridad,Otros,Otros
Magister de la Universidad de Buenos Aires en Ciencias Ambientales,Naturales,Ambiente
Magister de la Universidad de Buenos Aires en Ciencias Biomedicas,Salud,Medicina
Magister de la Universidad de Buenos Aires en Ciencias de la Ingenieria,Ingenieria,Otros
Magister de la Universidad de Buenos Aires en Ciencias Sociales,Sociales,Sociologia
Magister de la Universidad de Buenos Aires en Ciencias Sociales del Trabajo,Sociales,Recursos Humanos
Magister de la Universidad de Buenos Aires en Comunicacion y Cultura,Comunicacion,Periodismo
Magister de la Universidad de Buenos Aires en Conservacion de la Biodiversidad,Otros,Otros
Magister de la Universidad de Buenos Aires en Contabilidad Internacional,Economicas,Comercio Exterior
Magister de la Universidad de Buenos Aires en Derecho Administrativo y Administracion Publica,Juridicas,Otros
Magister de la Universidad de Buenos Aires en Derecho Comercial y de los Negocios,Juridicas,Abogacia
"Magister de la Universidad de Buenos Aires en Derecho de Familia, Infancia y Adolescencia",Juridicas,Otros
Magister de la Universidad de Buenos Aires en Derecho del Trabajo,Juridicas,Abogacia
Magister de la Universidad de Buenos Aires en Derecho Internacional de los Derechos Humanos,Juridicas,Abogacia
Magister de la Universidad de Buenos Aires en Derecho Internacional Privado,Juridicas,Abogacia
Magister de la Universidad de Buenos Aires en Derecho Penal,Juridicas,Otros
Magister de la Universidad de Buenos Aires en Derecho Penal del Mercosur,Juridicas,Abogacia
Magister de la Universidad de Buenos Aires en Derecho Penal del Mercosur con Orientacion en Derecho Penal Economico y Societario,Juridicas,Abogacia
Magister de la Universidad de Buenos Aires en Derecho Penal del Mercosur con orientacion en Derecho Penal Economico y Societario,Juridicas,Abogacia
