carrera,carrera_grupo,Carrera_normalizada
Profesor de Antropologia,Educacion,Profesorado
"Profesor de Armonia, Contrapunto y Morfologia Musical",Educacion,Profesorado
Profesor de Arpa,Otros,Otros
"Profesor de Arte en Artes Visuales Mencion Artes del Fuego para el Nivel Inicial, EGB I Y II",Educacion,
Profesor de Artes Dramaticas,Educacion,Profesorado
Profesor de Artes en Artes Visuales,Educacion,Profesorado
Profesor de Artes en Artes Visuales Orientacion Artes del Fuego,Educacion,Profesorado
"Profesor de Artes en Artes Visuales para el Nivel Inicial, EGB I y II",Educacion,Profesorado
Profesor de Artes en Danza,Educacion,Profesorado
"Profesor de Artes en Danza con Mencion en Expresion Corporal para el Nivel Inicial, EGB I y II",Educacion,Profesorado
"Profesor de Artes en Danza Mencion Danzas Folkloricas y Tango para el Nivel Inicial, EGB I y II",Educacion,Profesorado
Profesor de Artes en Danza Mencion en Danzas Folkloricas y Tango,Educacion,Profesorado
Profesor de Artes en Danza Mencion en Expresion Corporal,Educacion,Profesorado
"Profesor de Artes en Danza para el Nivel Inicial, EGB I y II",Educacion,Profesorado
Profesor de Artes en Folklore Mencion Instrumentos Criollos,Educacion,Profesorado
Profesor de Artes en Musica,Educacion,Profesorado
"Profesor de Artes en Musica para el Nivel Inicial, EGB I y II",Educacion,Profesorado
Profesor de Artes en Teatro,Educacion,Profesorado
"Profesor de Artes en Teatro para el Nivel Inicial, EGB I y II",Educacion,Profesorado
Profesor de Artes Visuales,Educacion,Profesorado
Profesor de Bibliotecologia y Ciencia de la Informacion,Educacion,Profesorado
Profesor de Biologia,Educacion,Profesorado
Profesor de Catequesis,Educacion,Profesorado
Profesor de Ciencias Biologicas,Educacion,Profesorado
Profesor de Ciencias Fisicas para Nivel Medio,Educacion,Profesorado
Profesor de Ciencias Sociales,Educacion,Profesorado
Profesor de Clarinete,Otros,Otros
Profesor de Computacion,Informatica,Profesorado
Profesor de Comunicacion Educativa,Comunicacion,Periodismo
Profesor de Comunicacion Social,Educacion,Profesorado
Profesor de Contrabajo,Otros,Otros
Profesor de Danza Contemporanea,Educacion,Profesorado
Profesor de Educacion,Educacion,Profesorado
Profesor de Educacion Especial,Educacion,Especial
Profesor de Educacion Especial en Ciegos y Disminuidos Visuales,Educacion,Especial
Profesor de Educacion Especial en Ciegos y Disminuidos Visuales - Ciclo de Profesorado,Educacion,Profesorado
Profesor de Educacion Especial en Retraso Mental,Educacion,Especial
Profesor de Educacion Especial en Retraso Mental - Ciclo de Profesorado,Educacion,Profesorado
Profesor de Educacion Especial en Sordos e Hipoacusicos,Educacion,Especial
Profesor de Educacion Especial en Sordos e Hipoacusicos - Ciclo de Profesorado,Educacion,Profesorado
Profesor de Educacion Fisica,Otros,Educacion Fisica y Deportes
"Profesor de Educacion General Basica, 1er. y 2do. Ciclo",Educacion,Primaria
Profesor de Educacion Inicial,Educacion,Inicial
Profesor de Educacion Inicial con Orientacion Rural,Educacion,Inicial
Profesor de Educacion Inicial con orientacion Rural,Economicas,Adm. Agraria
Profesor de Educacion Media en Tecnologia,Educacion,Tecnologia Educativa
Profesor de Educacion Media y Superior en Tecnologia,Educacion,Tecnologia Educativa
Profesor de Educacion Musical,Educacion,Profesorado
Profesor de Educacion PriMaria,Educacion,Primaria
Profesor de Educacion Primaria,Educacion,Profesorado
Profesor de Educacion PriMaria con Orientacion Rural,Educacion,Primaria
Profesor de Educacion Secundaria y Superior en Tecnologias de la Informacion y la Comunicacion,Educacion,Profesorado
Profesor de Educacion Superior - Ciclo de Profesorado,Educacion,Profesorado
Profesor de Educacion Superior en Musica: Canto,Educacion,Profesorado
Profesor de Educacion Superior en Musica: Clarinete,Artes,Musica
Profesor de Educacion Superior en Musica: Contrabajo,Educacion,Profesorado
Profesor de Educacion Superior en Musica: Fagot,Educacion,Profesorado
Profesor de Educacion Superior en Musica: Flauta,Educacion,Profesorado
Profesor de Educacion Superior en Musica: Guitarra,Educacion,Profesorado
Profesor de Educacion Superior en Musica: Oboe,Educacion,Profesorado
Profesor de Educacion Superior en Musica: Percusion,Educacion,Profesorado
Profesor de Educacion Superior en Musica: Piano,Educacion,Profesorado
Profesor de Educacion Superior en Musica: Piano - Musica de Camara y Repertorio Vocal,Educacion,Profesorado
Profesor de Educacion Superior en Musica: Saxofon,Educacion,Profesorado
Profesor de Educacion Superior en Musica: Trombon,Artes,Musica
Profesor de Educacion Superior en Musica: Trompeta,Artes,Musica
Profesor de Educacion Superior en Musica: Tuba,Artes,Musica
Profesor de Educacion Superior en Musica: Viola,Educacion,Profesorado
Profesor de Educacion Superior en Musica: Violin,Educacion,Profesorado
Profesor de Educacion Superior en Musica: Violonchelo,Artes,Musica
Profesor de Enseñanza Basica en Ingles,Educacion,Primaria
Profesor de Enseñanza de Nivel Medio y Superior en Biologia - Ciclo de Profesorado - MD,Educacion,Profesorado
Profesor de Enseñanza de Nivel Medio y Superior en Fisica - Ciclo de Profesorado - MD,Educacion,Profesorado
Profesor de Enseñanza de Nivel Medio y Superior en Matematica - Ciclo de Profesorado - MD,Educacion,Profesorado
Profesor de Enseñanza de Nivel Medio y Superior en Quimica - Ciclo de Profesorado - MD,Educacion,Profesorado
Profesor de Enseñanza Diferenciada,Educacion,Especial
Profesor de Enseñanza General Basica,Otros,Otros
Profesor de Enseñanza Media en Ciencias de la Educacion,Educacion,Profesorado
Profesor de Enseñanza Media en Filosofia,Otros,Otros
Profesor de Enseñanza Media en Geografia,Otros,Otros
Profesor de Enseñanza Media en Historia,Sociales,Historia y Geografia
Profesor de Enseñanza Media en Letras,Otros,Otros
Profesor de Enseñanza Media y Superior en Artes,Educacion,Profesorado
Profesor de Enseñanza Media y Superior en Artes (Orientacion Artes Combinadas),Educacion,Profesorado
Profesor de Enseñanza Media y Superior en Artes (Orientacion Artes Plasticas),Educacion,Profesorado
Profesor de Enseñanza Media y Superior en Artes (Orientacion Musica),Educacion,Profesorado
Profesor de Enseñanza Media y Superior en Bibliotecologia y Ciencia de la Informacion,Educacion,Profesorado
Profesor de Enseñanza Media y Superior en Ciencia Politica,Educacion,Profesorado
Profesor de Enseñanza Media y Superior en Ciencias Antropologicas,Educacion,Profesorado
Profesor de Enseñanza Media y Superior en Ciencias Biologicas,Educacion,Profesorado
Profesor de Enseñanza Media y Superior en Ciencias de la Atmosfera,Educacion,Profesorado
Profesor de Enseñanza Media y Superior en Ciencias de la Computacion,Informatica,Profesorado
Profesor de Enseñanza Media y Superior en Ciencias de la Comunicacion Social,Educacion,Profesorado
Profesor de Enseñanza Media y Superior en Ciencias de la Educacion,Educacion,Profesorado
Profesor de Enseñanza Media y Superior en Ciencias Economicas,Economicas,Economia y Finanzas
Profesor de Enseñanza Media y Superior en Ciencias Economicas - Ciclo de Complementacion Curricular,Educacion,Profesorado
Profesor de Enseñanza Media y Superior en Ciencias Geologicas,Educacion,Profesorado
Profesor de Enseñanza Media y Superior en Filosofia,Educacion,Profesorado
Profesor de Enseñanza Media y Superior en Filosofia y Pedagogia,Educacion,Profesorado
Profesor de Enseñanza Media y Superior en Fisica,Educacion,Profesorado
Profesor de Enseñanza Media y Superior en Geografia,Educacion,Profesorado
Profesor de Enseñanza Media y Superior en Historia,Educacion,Profesorado
Profesor de Enseñanza Media y Superior en Ingles,Comunicacion,Idiomas Extranjeros
Profesor de Enseñanza Media y Superior en la especialidad Biologia,Educacion,Profesorado
Profesor de Enseñanza Media y Superior en Lengua y Literatura Inglesa,Educacion,Profesorado
Profesor de Enseñanza Media y Superior en Letras,Educacion,Profesorado
Profesor de Enseñanza Media y Superior en Matematica,Educacion,Profesorado
Profesor de Enseñanza Media y Superior en Matematica y Computacion,Informatica,Profesorado
Profesor de Enseñanza Media y Superior en Psicologia,Educacion,Profesorado
Profesor de Enseñanza Media y Superior en Quimica,Educacion,Profesorado
Profesor de Enseñanza Media y Superior en Relaciones del Trabajo,Educacion,Profesorado
Profesor de Enseñanza Media y Superior en Trabajo Social,Educacion,Profesorado
Profesor de Enseñanza Pre-PriMaria,Educacion,Inicial
Profesor de Enseñanza Pre-Primaria,Otros,Otros
Profesor de Enseñanza PriMaria,Educacion,Primaria
Profesor de Enseñanza Primaria,Otros,Otros
Profesor de Enseñanza PriMaria en Ingles,Educacion,Primaria
Profesor de Enseñanza Primaria en Ingles,Comunicacion,Idiomas Extranjeros
"Profesor de Enseñanza Secundaria, Normal y Especial en Filosofia",Otros,Otros
"Profesor de Enseñanza Secundaria, Normal y Especial en Sociologia",Educacion,Profesorado
Profesor de Enseñanza Superior,Otros,Otros
Profesor de Enseñanza Superior - Ciclo de Profesorado,Educacion,Profesorado
Profesor de Equitacion - Ciclo de Profesorado,Otros,Educacion Fisica y Deportes
Profesor de Filosofia,Educacion,Profesorado
Profesor de Fisica,Educacion,Profesorado
Profesor de Fisica y Quimica,Educacion,Profesorado
Profesor de Flauta Traversa,Educacion,Profesorado
Profesor de Frances,Educacion,Profesorado
Profesor de Geografia,Educacion,Profesorado
Profesor de Geografia para el Tercer Ciclo de la Educacion General Basica y Educacion Polimodal,Educacion,Profesorado
Profesor de Grado Universitaria - Ciclo de Profesorado,Educacion,Profesorado
Profesor de Grado Universitaria de Ceramica Artistica,Educacion,Profesorado
Profesor de Grado Universitaria de Historia del Arte,Educacion,Profesorado
Profesor de Grado Universitaria de Teorias Musicales,Educacion,Profesorado
Profesor de Grado Universitaria en ( la disciplina correspondiente ) - Ciclo de Profesorado,Educacion,Profesorado
Profesor de Grado Universitaria en Administracion - Ciclo de Profesorado,Educacion,Profesorado
Profesor de Grado Universitaria en Arquitectura - Ciclo de Profesorado,Educacion,Profesorado
Profesor de Grado Universitaria en Artes Visuales,Educacion,Profesorado
Profesor de Grado Universitaria en Ciencia Politica - Ciclo de Profesorado,Educacion,Profesorado
Profesor de Grado Universitaria en Ciencias Basicas con Orientacion en Biologia,Educacion,Profesorado
Profesor de Grado Universitaria en Ciencias Basicas con Orientacion en Fisica,Educacion,Profesorado
Profesor de Grado Universitaria en Ciencias Basicas con Orientacion en Matematica,Educacion,Profesorado
Profesor de Grado Universitaria en Ciencias Basicas con Orientacion en Quimica,Educacion,Profesorado
Profesor de Grado Universitaria en Ciencias de la Educacion,Educacion,Profesorado
Profesor de Grado Universitaria en Comunicacion Social - Ciclo de Profesorado,Educacion,Profesorado
Profesor de Grado Universitaria en Danza - Ciclo de Profesorado,Educacion,Profesorado
Profesor de Grado Universitaria en Diseño - Ciclo de Profesorado,Educacion,Profesorado
Profesor de Grado Universitaria en Educacion General Basica para el Primero y Segundo Ciclo,Educacion,Primaria
Profesor de Grado Universitaria en Escenografia - Ciclo de Profesorado,Educacion,Profesorado
Profesor de Grado Universitaria en Filosofia,Educacion,Profesorado
Profesor de Grado Universitaria en Geografia,Educacion,Profesorado
Profesor de Grado Universitaria en Historia,Educacion,Profesorado
Profesor de Grado Universitaria en Lengua y Cultura Inglesas,Educacion,Profesorado
Profesor de Grado Universitaria en Lengua y Cultura Italianas,Educacion,Profesorado
Profesor de Grado Universitaria en Lengua y Literatura,Educacion,Profesorado
Profesor de Grado Universitaria en Lengua y Literatura Francesas,Educacion,Profesorado
Profesor de Grado Universitaria en Musica,Educacion,Profesorado
Profesor de Grado Universitaria en Musica - Ciclo de Profesorado,Educacion,Profesorado
Profesor de Grado Universitaria en Portugues,Educacion,Profesorado
Profesor de Grado Universitaria en Quimica,Educacion,Profesorado
Profesor de Grado Universitaria en Relaciones Internacionales - Ciclo de Profesorado,Educacion,Profesorado
Profesor de Grado Universitaria en Sordos y Terapia del Lenguaje,Educacion,Especial
Profesor de Grado Universitaria en Teatro,Educacion,Profesorado
Profesor de Grado Universitaria en Trabajo Social - Ciclo de Profesorado,Educacion,Profesorado
Profesor de Grado Universitario - Ciclo de Profesorado,Otros,Otros
Profesor de Grado Universitario de Ceramica Artistica,Otros,Otros
Profesor de Grado Universitario de Historia del Arte,Sociales,Historia y Geografia
Profesor de Grado Universitario de Teorias Musicales,Artes,Musica
Profesor de Grado Universitario en ( la disciplina correspondiente ) - Ciclo de Profesorado,Otros,Otros
Profesor de Grado Universitario en (la disciplina que corresponde al titulo de grado) - Ciclo de Profesorado,Otros,Otros
Profesor de Grado Universitario en Administracion - Ciclo de Profesorado,Otros,Otros
Profesor de Grado Universitario en Arquitectura - Ciclo de Profesorado,Arquitectura y Urbanismo,Arquitectura
Profesor de Grado Universitario en Artes Visuales,Artes,Visuales
Profesor de Grado Universitario en Ciencia Politica - Ciclo de Profesorado,Otros,Otros
Profesor de Grado Universitario en Ciencias Basicas con orientacion en Biologia,Otros,Otros
Profesor de Grado Universitario en Ciencias Basicas con orientacion en Fisica,Otros,Otros
Profesor de Grado Universitario en Ciencias Basicas con orientacion en Matematica,Otros,Otros
Profesor de Grado Universitario en Ciencias Basicas con orientacion en Quimica,Otros,Otros
Profesor de Grado Universitario en Ciencias de la Educacion,Educacion,Profesorado
Profesor de Grado Universitario en Comunicacion Social - Ciclo de Profesorado,Otros,Otros
Profesor de Grado Universitario en Diseño - Ciclo de Profesorado,Otros,Otros
Profesor de Grado Universitario en Educacion General Basica para el Primero y Segundo Ciclo,Educacion,Profesorado
Profesor de Grado Universitario en Escenografia - Ciclo de Profesorado,Otros,Otros
Profesor de Grado Universitario en Filosofia,Otros,Otros
Profesor de Grado Universitario en Geografia,Otros,Otros
Profesor de Grado Universitario en Historia,Sociales,Historia y Geografia
Profesor de Grado Universitario en Lengua y Cultura Inglesas,Comunicacion,Idiomas Extranjeros
Profesor de Grado Universitario en Lengua y Cultura Italianas,Otros,Otros
Profesor de Grado Universitario en Lengua y Literatura,Otros,Otros
Profesor de Grado Universitario en Lengua y Literatura Francesas,Comunicacion,Idiomas Extranjeros
Profesor de Grado Universitario en Musica,Artes,Musica
Profesor de Grado Universitario en Musica - Ciclo de Profesorado,Artes,Musica
Profesor de Grado Universitario en Portugues,Comunicacion,Idiomas Extranjeros
Profesor de Grado Universitario en Quimica,Otros,Otros
Profesor de Grado Universitario en Relaciones Internacionales - Ciclo de Profesorado,Otros,Otros
Profesor de Grado Universitario en Sordos y Terapia del Lenguaje,Otros,Otros
Profesor de Grado Universitario en Teatro,Otros,Otros
Profesor de Grado Universitario en Trabajo Social - Ciclo de Profesorado,Otros,Otros
Profesor de Guitarra,Educacion,Profesorado
Profesor de Historia,Educacion,Profesorado
Profesor de Historia de las Artes Plasticas,Artes,Visuales
Profesor de Informatica para Enseñanza Media,Educacion,Profesorado
Profesor de Ingles,Educacion,Profesorado
Profesor de Ingles para el Tercer Ciclo de la Educacion General Basica,Educacion,Primaria
"Profesor de Ingles para el Tercer Ciclo de la Educacion General Basica, la Educacion Polimodal y el Nivel Superior",Educacion,Profesorado
Profesor de Ingles para Enseñanza General Basica,Educacion,Profesorado
Profesor de Ingles para la Educacion Inicial y el Primero y Segundo Ciclos de la Educacion General Basica,Educacion,Primaria
Profesor de Ingles para Nivel Inicial y EGB 1 y 2,Educacion,Primaria
Profesor de Ingles para Primer y Segundo Ciclo de la Educacion General Basica,Educacion,Primaria
"Profesor de Ingles y Literatura Inglesa en Enseñanza Media, Superior y Universitaria",Comunicacion,Idiomas Extranjeros
Profesor de Jardin de Infantes,Otros,Otros
Profesor de Lengua Alemana,Educacion,Profesorado
Profesor de Lengua Castellana para el Tercer Ciclo de la Educacion General Basica y Educacion Polimodal,Educacion,Profesorado
Profesor de Lengua Francesa,Educacion,Profesorado
Profesor de Lengua Inglesa,Educacion,Profesorado
Profesor de Lengua Inglesa para el Tercer Ciclo de la Educacion General Basica y Educacion Polimodal,Educacion,Profesorado
Profesor de Lengua Italiana,Educacion,Profesorado
Profesor de Lengua y Literatura,Comunicacion,Letras
Profesor de Letras,Educacion,Profesorado
Profesor de Letras para el Tercer Ciclo de la Educacion General Basica y Educacion Polimodal,Educacion,Profesorado
Profesor de Matematica,Educacion,Profesorado
Profesor de Matematica - Ciclo Profesorado,Educacion,Otros
Profesor de Matematica para el Tercer Ciclo de la Educacion General Basica y Educacion Polimodal,Educacion,Profesorado
Profesor de Musica,Educacion,Profesorado
Profesor de Musica con Orientacion en Canto,Educacion,Profesorado
Profesor de Musica con Orientacion en Clarinete,Educacion,Profesorado
Profesor de Musica con Orientacion en Composicion,Educacion,Profesorado
Profesor de Musica con Orientacion en Contrabajo,Educacion,Profesorado
Profesor de Musica con Orientacion en Direccion Coral,Educacion,Profesorado
Profesor de Musica con orientacion en Direccion Coral,Artes,Musica
Profesor de Musica con Orientacion en Direccion Orquestal,Educacion,Profesorado
Profesor de Musica con Orientacion en Educacion Musical,Educacion,Profesorado
Profesor de Musica con orientacion en Educacion Musical,Artes,Musica
Profesor de Musica con Orientacion en Flauta,Educacion,Profesorado
Profesor de Musica con Orientacion en Guitarra,Educacion,Profesorado
Profesor de Musica con orientacion en Guitarra,Artes,Musica
Profesor de Musica con orientacion en Musica Popular,Artes,Musica
Profesor de Musica con Orientacion en organo,Artes,Musica
Profesor de Musica con Orientacion en Percusion,Educacion,Profesorado
Profesor de Musica con Orientacion en Piano,Educacion,Profesorado
Profesor de Musica con orientacion en Piano,Artes,Musica
Profesor de Musica con Orientacion en Saxo,Educacion,Profesorado
Profesor de Musica con Orientacion en Viola,Artes,Musica
Profesor de Musica con Orientacion en Violin,Educacion,Profesorado
Profesor de Musica con Orientacion en Violonchelo,Educacion,Profesorado
Profesor de Musica con Orientaciones,Educacion,Profesorado
Profesor de Musica en la Enseñanza General Basica,Educacion,Profesorado
Profesor de Musica Orientacion Direccion Orquestal,Educacion,Profesorado
"Profesor de Musica, Orientacion Composicion",Educacion,Profesorado
"Profesor de Musica, orientacion Composicion",Artes,Musica
"Profesor de Musica, Orientacion Educacion Musical",Educacion,Profesorado
"Profesor de Musica, orientacion Educacion Musical",Artes,Musica
Profesor de Nivel Inicial,Educacion,Inicial
Profesor de Nivel Medio y Superior en Biologia,Educacion,Profesorado
Profesor de Nivel Medio y Superior en Ciencias Naturales,Educacion,Profesorado
Profesor de Nivel Medio y Superior en Economia,Educacion,Profesorado
Profesor de Nivel Medio y Superior en Fisica,Educacion,Profesorado
Profesor de Nivel Medio y Superior en Quimica,Educacion,Profesorado
Profesor de Nivel Medio y Superior en Teatro,Educacion,Profesorado
Profesor de Nivel Superior en Biologia,Educacion,Profesorado
Profesor de Pedagogia - Ciclo de Profesorado,Educacion,Profesorado
Profesor de Piano,Educacion,Profesorado
Profesor de Portugues,Educacion,Profesorado
Profesor de Primero y Segundo Ciclo de la Educacion General Basica,Educacion,Primaria
Profesor de Primero y Segundo Ciclo de la Educacion General Basica - Ciclo de Profesorado,Educacion,Primaria
Profesor de Primero y Segundo Ciclo de la Educacion General Basica con Orientacion Rural,Educacion,Primaria
Profesor de Primero y Segundo Ciclo de la Educacion General Basica con orientacion Rural,Economicas,Adm. Agraria
Profesor de Psicologia,Educacion,Profesorado
Profesor de Quimica,Educacion,Profesorado
Profesor de Quimica de Nivel Superior,Educacion,Profesorado
Profesor de Quimica para la Enseñanza Media y Superior,Educacion,Profesorado
Profesor de Saxofon,Educacion,Profesorado
Profesor de Sociologia,Educacion,Profesorado
Profesor de Sordos y Perturbados del Lenguaje,Otros,Otros
Profesor de Teatro,Educacion,Profesorado
Profesor de Tecnologia,Educacion,Tecnologia Educativa
Profesor de Tercer Ciclo de E.G.B. y Educacion Polimodal en Historia,Sociales,Historia y Geografia
Profesor de Tercer Ciclo de la E.G.B. y de la Educacion Polimodal en Quimica,Educacion,Profesorado
Profesor de Tercer Ciclo de la Educacion General Basica y Educacion Polimodal en Historia,Educacion,Profesorado
Profesor de Tercer Ciclo de la Educacion General Basica y Educacion Polimodal en Matematica,Educacion,Profesorado
Profesor de Tercer Ciclo de la Enseñanza General Basica y de la Educacion Polimodal en Matematica,Educacion,Profesorado
Profesor de Trompeta,Artes,Musica
Profesor de Viola,Artes,Musica
Profesor de Violin,Educacion,Profesorado
Profesor de Violonchelo,Otros,Otros
Profesor del Tercer Ciclo de la E.G.B. y de la Educacion Polimodal en Matematica,Educacion,Profesorado
Profesor en (campo disciplinar segun titulacion de base) - Ciclo de Profesorado,Educacion,Profesorado
Profesor en Antropologia,Educacion,Profesorado
"Profesor en Armonia, Contrapunto y Morfologia Musical",Educacion,Profesorado
Profesor en Arpa,Educacion,Profesorado
Profesor en Arquitectura,Arquitectura y Urbanismo,Arquitectura
Profesor en Arte con Orientacion en Lenguaje Musical,Educacion,Profesorado
Profesor en Artes Audiovisuales,Educacion,Profesorado
Profesor en Artes Plasticas,Educacion,Profesorado
Profesor en Artes Plasticas - Ciclo de Profesorado,Educacion,Profesorado
"Profesor en Artes Plasticas, con Orientacion en Ceramica",Educacion,Profesorado
"Profesor en Artes Plasticas, con orientacion en Ceramica",Artes,Visuales
"Profesor en Artes Plasticas, con Orientacion en Dibujo",Educacion,Profesorado
"Profesor en Artes Plasticas, con orientacion en Dibujo",Artes,Visuales
"Profesor en Artes Plasticas, con Orientacion en Escenografia",Educacion,Profesorado
"Profesor en Artes Plasticas, con orientacion en Escenografia",Artes,Visuales
"Profesor en Artes Plasticas, con Orientacion en Grabado y Arte Impreso",Educacion,Profesorado
"Profesor en Artes Plasticas, con orientacion en Grabado y Arte Impreso",Artes,Visuales
"Profesor en Artes Plasticas, con Orientacion en Muralismo y Arte Publico Monumental",Educacion,Profesorado
"Profesor en Artes Plasticas, con orientacion en Muralismo y Arte Publico Monumental",Artes,Visuales
"Profesor en Artes Plasticas, con Orientacion en Pintura",Educacion,Profesorado
"Profesor en Artes Plasticas, con orientacion en Pintura",Artes,Visuales
"Profesor en Artes Plasticas, Orientacion Escultura",Educacion,Profesorado
"Profesor en Artes Plasticas, orientacion Escultura",Artes,Visuales
Profesor en Artes Visuales,Educacion,Profesorado
"Profesor en Artes Visuales para Educacion Inicial, PriMaria, Media",Educacion,Profesorado
Profesor en Bellas Artes,Educacion,Profesorado
Profesor en Bibliotecologia,Otros,Bibliotecologia y Documentacion
Profesor en Bibliotecologia y Ciencia de la Informacion,Educacion,Profesorado
Profesor en Bibliotecologia y Documentacion,Educacion,Profesorado
Profesor en Biologia,Educacion,Profesorado
Profesor en Canto,Educacion,Profesorado
Profesor en Canto con orientacion en Canto de Camara,Otros,Otros
Profesor en Canto con orientacion en Canto Lirico,Otros,Otros
Profesor en Canto Lirico,Educacion,Profesorado
Profesor en Ciencia Politica y Administracion Publica - Ciclo de Profesorado,Educacion,Profesorado
Profesor en Ciencias Agrarias - Ciclo Profesorado,Economicas,Adm. Agraria
Profesor en Ciencias Agropecuarias,Educacion,Profesorado
Profesor en Ciencias Biologicas,Educacion,Profesorado
Profesor en Ciencias de la Computacion,Informatica,Profesorado
Profesor en Ciencias de la Educacion,Educacion,Profesorado
Profesor en Ciencias de la Educacion - Ciclo de Formacion Docente,Educacion,Profesorado
Profesor en Ciencias de la Educacion - Ciclo de Profesorado,Educacion,Profesorado
Profesor en Ciencias de la Educacion - MD,Educacion,Profesorado
Profesor en Ciencias de la Religion,Sociales,Filosofia
Profesor en Ciencias Economicas,Educacion,Profesorado
Profesor en Ciencias Economicas - Ciclo de Profesorado,Educacion,Profesorado
Profesor en Ciencias Juridicas,Educacion,Profesorado
Profesor en Ciencias Juridicas - Ciclo de Profesorado,Educacion,Profesorado
Profesor en Ciencias Juridicas y Politicas,Otros,Otros
Profesor en Ciencias Juridicas y Politicas - Ciclo de Profesorado,Otros,Otros
"Profesor en Ciencias Juridicas, Politicas y Sociales",Educacion,Profesorado
Profesor en Ciencias Medicas,Educacion,Profesorado
Profesor en Ciencias Naturales,Educacion,Profesorado
Profesor en Ciencias Naturales para el Tercer Ciclo de Enseñanza General Basica y Educacion Polimodal,Educacion,Profesorado
Profesor en Ciencias Politicas - Ciclo de Complementacion Curricular,Otros,Otros
Profesor en Ciencias Quimicas y del Ambiente,Educacion,Profesorado
Profesor en Ciencias Quimicas y del Medio Ambiente,Educacion,Profesorado
Profesor en Ciencias Sociales,Educacion,Profesorado
"Profesor en Cinematografia, Orientacion Compaginacion",Educacion,Profesorado
"Profesor en Cinematografia, orientacion Compaginacion",Otros,Otros
"Profesor en Cinematografia, Orientacion Direccion",Educacion,Profesorado
